Ranking;Cla;Jogador;Lutou_Hoje;Ataques_Feitos;Fama_Hoje;Deck_1;Deck_2;Deck_3;Deck_4
1;macondo;SLIMCIRE;Sim;4/4;1700;Barbarian Barrel, Dart Goblin, Furnace, Goblin Drill, Inferno Dragon, Poison, Skeleton King, Wall Breakers;Arrows, Baby Dragon, Earthquake, Firecracker, Guards, Mini P.E.K.K.A, Minions, Royal Giant;Deck nao encontrado no log recente;Deck nao encontrado no log recente
2;macondo;Parce lero;Sim;4/4;1500;Arrows, Goblin Cage, Goblin Gang, Minions, P.E.K.K.A, Poison, Royal Ghost, Wizard;Barbarian Barrel, Bomb Tower, Firecracker, Giant, Guards, Lightning, Prince, Witch;Baby Dragon, Executioner, Fireball, Goblin Barrel, Inferno Tower, Knight, Mega Knight, Musketeer;Barbarians, Dart Goblin, Flying Machine, Giant Skeleton, Magic Archer, Rocket, The Log, Valkyrie
3;macondo;mantis;Sim;4/4;1300;Balloon, Elite Barbarians, Executioner, Flying Machine, Knight, Lightning, Lumberjack, Zap;Arrows, Baby Dragon, Battle Ram, Fireball, Mini P.E.K.K.A, Royal Delivery, Royal Recruits, Wizard;Dark Prince, Mega Knight, Minions, Tesla, The Log, Valkyrie, Vines, Witch;Barbarian Barrel, Barbarians, Firecracker, Giant, Golden Knight, Inferno Tower, Musketeer, Rocket
4;macondo;reveis;Sim;4/4;1200;Baby Dragon, Fireball, Goblin Cage, Magic Archer, Mega Knight, Musketeer, Royal Delivery, Royal Ghost;Arrows, Earthquake, Executioner, Golden Knight, Inferno Tower, Lumberjack, Royal Recruits, Valkyrie;Barbarians, Bats, Flying Machine, Giant Skeleton, Poison, Royal Hogs, The Log, Witch;Barbarian Barrel, Elite Barbarians, Firecracker, Guards, Knight, Lightning, Tesla, Wizard
5;macondo;gaston;Sim;4/4;1100;Arrows, Baby Dragon, Freeze, Knight, Magic Archer, Musketeer, Royal Recruits, Skeleton Barrel;Bandit, Fireball, Firecracker, Giant Skeleton, Inferno Tower, Royal Ghost, Witch, Zap;Elite Barbarians, Guards, Lightning, Monk, Tesla, The Log, Valkyrie, Wizard;Barbarian Barrel, Barbarians, Elixir Golem, Executioner, Flying Machine, Inferno Dragon, Mini P.E.K.K.A, Poison
1;NORD DE FRANCE;jojo;Sim;4/4;1600;Archer Queen, Archers, Goblin Barrel, Musketeer, P.E.K.K.A, Princess, Skeleton Army, Valkyrie;Balloon, Barbarian Barrel, Dart Goblin, Goblin Gang, Golden Knight, Mini P.E.K.K.A, Prince, Wizard;Deck nao encontrado no log recente;Deck nao encontrado no log recente
2;NORD DE FRANCE;WarZouZ;Sim;4/4;1450;Baby Dragon, Cannon Cart, Fireball, Firecracker, Golden Knight, Guards, Ice Wizard, Knight;Deck nao encontrado no log recente;Deck nao encontrado no log recente;Deck nao encontrado no log recente
3;NORD DE FRANCE;samy;Sim;4/4;1400;Electro Wizard, Goblins, Hog Rider, Mini P.E.K.K.A, Spear Goblins, Wall Breakers, Witch, Zap;Balloon, Bomber, Bowler, Giant Snowball, Goblin Barrel, Goblin Curse, Goblin Gang, Magic Archer;Balloon, Bomber, Bowler, Elite Barbarians, Giant Snowball, Goblin Curse, Goblin Gang, Magic Archer;Archer Queen, Arrows, Barbarian Barrel, Firecracker, Knight, Mega Knight, Night Witch, Rage
4;NORD DE FRANCE;depeche mode;Sim;4/4;1400;Electro Dragon, Fireball, Goblins, Mega Knight, Princess, Royal Giant, Royal Hogs, Zappies;Dart Goblin, Electro Wizard, Elixir Golem, Executioner, Freeze, Furnace, Royal Ghost, Skeleton Dragons;Bowler, Firecracker, Flying Machine, Goblin Gang, Magic Archer, Prince, Ram Rider, Tombstone;Baby Dragon, Hog Rider, Inferno Tower, Rage, Skeleton Army, Valkyrie, Witch, Wizard
5;NORD DE FRANCE;scalpex;Sim;4/4;1350;Archers, Bats, Electro Giant, Electro Wizard, Fireball, Goblin Barrel, Little Prince, Mini P.E.K.K.A;Arrows, Baby Dragon, Cannon, Inferno Dragon, Knight, Miner, Royal Giant, Skeleton Army;Deck nao encontrado no log recente;Deck nao encontrado no log recente
1;Tropa Do Bruxo;ips;Sim;4/4;1400;Archer Queen, Baby Dragon, Elite Barbarians, Goblin Gang, Mega Knight, Mega Minion, The Log, Witch;Bats, Firecracker, Inferno Tower, Knight, Mini P.E.K.K.A, Royal Giant, Wall Breakers, Wizard;Deck nao encontrado no log recente;Deck nao encontrado no log recente
2;Tropa Do Bruxo;BybyZx;Sim;2/4;500;Dart Goblin, Goblin Curse, Mega Knight, Miner, Princess, Royal Giant, Skeleton King, Witch;Barbarian Hut, Boss Bandit, Executioner, Fire Spirit, Goblin Drill, Goblin Hut, Tombstone, Valkyrie;Barbarian Barrel, Cannon, Earthquake, Electro Spirit, Firecracker, Hog Rider, Royal Delivery, Skeletons;Arrows, Electro Dragon, Golem, Lumberjack, Mini P.E.K.K.A, Sparky, Tornado, Zap
3;Tropa Do Bruxo;LZ-17;Sim;3/4;300;Elite Barbarians, Executioner, Firecracker, Giant Skeleton, Lumberjack, Rocket, Skeleton Barrel, Zap;Deck nao encontrado no log recente;Deck nao encontrado no log recente;Deck nao encontrado no log recente
4;Tropa Do Bruxo;Λ Яᄃ λ Ð Є;Sim;1/4;100;Electro Spirit, Executioner, Fisherman, Hunter, Monk, Royal Ghost, Royal Giant, Zappies;Deck nao encontrado no log recente;Deck nao encontrado no log recente;Deck nao encontrado no log recente
5;Tropa Do Bruxo;fernando;Nao;0/4;0;Elite Barbarians, Fireball, Firecracker, Inferno Tower, Minion Horde, Royal Hogs, The Log, Zap;Deck nao encontrado no log recente;Deck nao encontrado no log recente;Deck nao encontrado no log recente
1;cymru warriors;Nathan;Sim;4/4;1500;Dark Prince, Firecracker, Hog Rider, Hunter, Magic Archer, Mega Knight, Valkyrie, Zap;Deck nao encontrado no log recente;Deck nao encontrado no log recente;Deck nao encontrado no log recente
2;cymru warriors;Valeryon07;Sim;4/4;1400;Archers, Elite Barbarians, Executioner, Goblin Barrel, Inferno Tower, Rage, The Log, Tombstone;Bomb Tower, Hog Rider, Knight, Magic Archer, Minion Horde, Skeletons, Sparky, Zap;Arrows, Barbarians, Bats, Cannon, Electro Giant, Goblin Gang, Princess, Wizard;Deck nao encontrado no log recente
3;cymru warriors;Andy O;Sim;4/4;1400;Barbarians, Electro Dragon, Elite Barbarians, Elixir Golem, Executioner, Inferno Tower, Magic Archer, Royal Hogs;Deck nao encontrado no log recente;Deck nao encontrado no log recente;Deck nao encontrado no log recente
4;cymru warriors;DuffMiver;Sim;4/4;1350;Battle Ram, Executioner, Flying Machine, Goblins, P.E.K.K.A, Suspicious Bush, Void, Wizard;Dart Goblin, Goblinstein, Mega Knight, Poison, Royal Giant, The Log, Valkyrie, Zap;Arrows, Electro Giant, Elite Barbarians, Lightning, Musketeer, Rage, Skeleton Army, Spear Goblins;Fireball, Firecracker, Freeze, Goblin Gang, Hog Rider, Lumberjack, Minions, Witch
5;cymru warriors;doodlemaus;Sim;4/4;1350;Barbarian Barrel, Bats, Elixir Golem, Executioner, Giant Skeleton, Knight, Skeleton Army, Sparky;Arrows, Battle Healer, Electro Dragon, Elite Barbarians, Goblin Cage, Skeleton Dragons, Spear Goblins, Valkyrie;Berserker, Electro Spirit, Fire Spirit, Firecracker, Furnace, Golem, Guards, Ice Spirit;Bandit, Barbarians, Dart Goblin, Goblin Barrel, Magic Archer, P.E.K.K.A, Skeleton Barrel, Wall Breakers
1;Critical THC;the notorious;Sim;4/4;1500;Executioner, Firecracker, Giant, Goblin Gang, Goblin Hut, Goblins, Lumberjack, Skeletons;Deck nao encontrado no log recente;Deck nao encontrado no log recente;Deck nao encontrado no log recente
2;Critical THC;Boss;Sim;4/4;1300;Dark Prince, Electro Spirit, Electro Wizard, Fireball, Goblin Cage, Minions, Royal Giant, The Log;Barbarian Barrel, Giant Snowball, Graveyard, Ice Spirit, Ice Wizard, Poison, Tesla, Valkyrie;Balloon, Bats, Bomber, Fire Spirit, Firecracker, Golden Knight, Mini P.E.K.K.A, Tornado;Archers, Arrows, Cannon, Dart Goblin, Goblin Barrel, Goblin Gang, Knight, Wall Breakers
3;Critical THC;Mandarina;Sim;2/4;850;Arrows, Cannon, Hog Rider, Musketeer, Skeleton Army, Skeleton Barrel, Valkyrie, Witch;Deck nao encontrado no log recente;Deck nao encontrado no log recente;Deck nao encontrado no log recente
4;Critical THC;thomac;Sim;1/4;750;Bandit, Bats, Firecracker, Goblin Barrel, Mega Knight, Mini P.E.K.K.A, Royal Ghost, Skeleton Barrel;Deck nao encontrado no log recente;Deck nao encontrado no log recente;Deck nao encontrado no log recente
5;Critical THC;Ghaloz;Nao;0/4;600;Deck nao encontrado no log recente;Deck nao encontrado no log recente;Deck nao encontrado no log recente;Deck nao encontrado no log recente
