data_coleta;dia_batalha;conta_tipo;player_tag;player_nome;player_fame;player_posicao;clan_tag;clan_nome;clan_posicao;clan_fame;decks_usados;boat_attacks;deck_1;deck_1_tipo;deck_2;deck_2_tipo;deck_3;deck_3_tipo;deck_4;deck_4_tipo;war_vitorias;war_derrotas;war_medals;war_torre;war_battles_count
2026-07-09;Reset;#2QR292P;#8U92C9PJ2;shahinnajafi;200;4;#R0JUGVR9;TITA;4;0;2;0;Princess, Electro Wizard, Valkyrie, Elite Barbarians, Dart Goblin, Archers, Giant Skeleton, Minion Horde;Duelo;Executioner, Golden Knight, Firecracker, Mini P.E.K.K.A, Hog Rider, Goblin Barrel, Dark Prince, Sparky;Duelo;;;;;0;2;200;Tower Princess;1
2026-07-09;Reset;#2QR292P;#9J8P0VUC9;(☆اَمیرحُسینِ☆);400;3;#R0JUGVR9;TITA;4;0;3;0;Valkyrie, Executioner, Tornado, Royal Recruits, Goblin Barrel, Rocket, Princess, Skeleton Army;RangeBattle;Skeletons, Inferno Tower, Wizard, Elite Barbarians, Lumberjack, Freeze, Bats, Balloon;RangeBattle;Firecracker, Cannon, Boss Bandit, Earthquake, Electro Wizard, Hog Rider, Witch, P.E.K.K.A;RangeBattle;;;1;2;400;Tower Princess;3
2026-07-09;Reset;#2QR292P;#8RU2Q8QGR;USAF HC;450;2;#9C9UVJR8;Donations 2.0;2;0;4;4;Royal Giant, Wizard, Earthquake, Freeze, Balloon, Flying Machine, Electro Giant, Electro Wizard;Barco;Valkyrie, Electro Dragon, Boss Bandit, Inferno Tower, Night Witch, Graveyard, Three Musketeers, Golem;Barco;Archers, Golden Knight, Rocket, Knight, Inferno Dragon, Witch, Mega Knight, Fire Spirit;Barco;Executioner, P.E.K.K.A, Little Prince, Mirror, Battle Ram, Mother Witch, Spirit Empress, Baby Dragon;Barco;4;1;575;Tower Princess;5
2026-07-09;Reset;#2QR292P;#PPPLJ2PJ;KIRA;500;1;#9C9UVJR8;Donations 2.0;2;0;4;2;Witch, Magic Archer, Inferno Dragon, Giant Snowball, Royal Hogs, Princess, Flying Machine, Hog Rider;Barco;Wizard, Knight, Archers, Elite Barbarians, Ram Rider, P.E.K.K.A, Bomber, The Log;Barco;Dart Goblin, Skeleton King, Skeleton Army, Bats, Elixir Golem, Goblin Gang, Furnace, Fireball;RangeBattle;Royal Giant, Mega Minion, Mega Knight, Lightning, Mini P.E.K.K.A, Arrows, Minions, Firecracker;RangeBattle;2;2;500;Tower Princess;4
2026-07-09;Reset;#2QR292P;#JQ0U0U9P8;Angy4;500;2;#GQC8L2CG;TESCHIO NERO;5;0;4;0;Minion Horde, Inferno Dragon, Electro Dragon, Skeleton Dragons, Minions, Phoenix, Bats, Lava Hound;RangeBattle;Firecracker, Mega Knight, Witch, Goblin Barrel, Ram Rider, Furnace, Inferno Tower, Baby Dragon;RangeBattle;P.E.K.K.A, Skeletons, Flying Machine, Elixir Golem, Valkyrie, Fireball, Mother Witch, Cannon;RangeBattle;Executioner, Magic Archer, Little Prince, Goblin Hut, Ice Wizard, Hog Rider, Mirror, Bowler;RangeBattle;1;3;500;Tower Princess;4
2026-07-09;Reset;#2QR292P;#2UJ9YJQY;Lestat1984;575;1;#GQC8L2CG;TESCHIO NERO;5;0;4;1;Electro Giant, Hog Rider, Barbarians, Prince, P.E.K.K.A, Executioner, Skeleton Army, Valkyrie;Barco;Elite Barbarians, Minion Horde, Royal Hogs, Ram Rider;Barco;Mega Knight, Golden Knight, Executioner, Musketeer, Void, Barbarians, Goblin Barrel, Skeleton Army;RangeBattle;P.E.K.K.A, Mini P.E.K.K.A, Witch, Goblin Gang, Arrows, Princess, Royal Hogs, Bats;RangeBattle;3;4;850;Tower Princess;7
2026-07-09;Reset;#2QR292P;#YG9VCC998;Marcooo!11;600;3;#2Q2JGURL;www.geppetto.sk;3;0;4;0;Giant Snowball, Valkyrie, Witch, Rocket, Poison, Minion Horde, Tornado, Elite Barbarians;RangeBattle;Lumberjack, Elixir Golem, Hunter, Princess, Inferno Tower, Mother Witch, Guards, Fireball;RangeBattle;P.E.K.K.A, Musketeer, Dart Goblin, Goblin Gang, Skeleton Army, Arrows, Goblin Barrel, Giant Skeleton;RangeBattle;Mega Knight, Firecracker, Zap, Wizard, Goblins, Hog Rider, Knight, Sparky;RangeBattle;2;2;600;Tower Princess;4
2026-07-09;Reset;#2QR292P;#8U88JV0L;mog007;700;2;#2Q2JGURL;www.geppetto.sk;3;0;4;0;Executioner, Electro Wizard, Minion Horde, Mother Witch, Rage, Elite Barbarians, Goblin Gang, Dark Prince;RangeBattle;Valkyrie, Boss Bandit, Baby Dragon, Inferno Dragon, Witch, Fire Spirit, Goblin Demolisher, Archers;Duelo;Furnace, Wizard, Dart Goblin, Poison, Skeleton Army, Ram Rider, Bowler, Princess;Duelo;Electro Dragon, Giant Skeleton, Bats, Arrows, Minions, Firecracker, Giant, Night Witch;Duelo;2;1;600;Tower Princess;2
2026-07-09;Reset;#2QR292P;#YGGRCRV0V;Radman AS;700;2;#R0JUGVR9;TITA;4;0;4;0;Balloon, Boss Bandit, Mighty Miner, Executioner, Dart Goblin, Prince, Giant Snowball, Goblins;RangeBattle;Mega Knight, Elite Barbarians, Electro Wizard, Goblin Barrel, Arrows, Lumberjack, Musketeer, Skeleton Army;RangeBattle;Witch, Mini P.E.K.K.A, Wizard, Firecracker, Hog Rider, Goblin Gang, Magic Archer, Ice Spirit;RangeBattle;Valkyrie, Knight, Tesla, The Log, Bats, Ice Wizard, Electro Giant, Baby Dragon;RangeBattle;3;1;700;Tower Princess;4
2026-07-09;Reset;TOP_GLOBAL;#Q8VRCG20;hokum;800;5;#L9VRJ;Calalas España;1;0;4;0;Battle Ram, Magic Archer, Royal Ghost, Zap, Poison, P.E.K.K.A, Bandit, Electro Wizard;RangeBattle;Firecracker, Mighty Miner, Tesla, Hog Rider, Skeletons, Earthquake, The Log, Electro Spirit;Duelo;Royal Recruits, Barbarian Barrel, Goblin Cage, Royal Hogs, Arrows, Zappies, Flying Machine, Fireball;Duelo;Skeleton Barrel, Goblins, Mortar, Cannon Cart, Minions, Rascals, Royal Delivery, Lightning;Duelo;3;0;700;Tower Princess;2
2026-07-09;Reset;TOP_GLOBAL;#288VL09GC;Haqqi;800;5;#9U82JJ0Y;TheAddictedOnes;3;0;4;0;Royal Recruits, Goblins, Mighty Miner, Firecracker, Goblin Gang, Wall Breakers, Skeleton Barrel, Arrows;Duelo;Baby Dragon, Knight, Archers, Poison, Graveyard, Tornado, Barbarian Barrel, Tombstone;Duelo;Valkyrie, Wizard, Ice Spirit, Cannon, The Log, Skeletons, Hog Rider, Earthquake;Duelo;Battle Ram, P.E.K.K.A, Little Prince, Mother Witch, Royal Ghost, Bandit, Giant Snowball, Zap;RangeBattle;3;0;700;Tower Princess;2
2026-07-09;Reset;#2QR292P;#2R2JCYJV8;anton;800;1;#2Q2JGURL;www.geppetto.sk;3;0;4;0;Valkyrie, Witch, Mini P.E.K.K.A, Electro Wizard, Arrows, Goblin Gang, Goblin Barrel, Prince;RangeBattle;P.E.K.K.A, Goblins, Baby Dragon, Giant Snowball, The Log, Tornado, Skeleton Barrel, Executioner;RangeBattle;Knight, Furnace, Wizard, Mirror, Royal Ghost, Hog Rider, Lumberjack, Guards;Duelo;Mega Knight, Bats, Musketeer, Dart Goblin, Zap, Skeleton Army, Miner, Minions;Duelo;3;1;800;Tower Princess;3
2026-07-09;Reset;#2QR292P;#Q98GY088U;grin vich;800;1;#R0JUGVR9;TITA;4;0;4;0;Valkyrie, Royal Recruits, Inferno Dragon, Freeze, Wizard, Dart Goblin, Minion Horde, Royal Giant;RangeBattle;Mega Knight, P.E.K.K.A, Goblin Barrel, Rage, Giant Skeleton, Bats, Executioner, Mother Witch;RangeBattle;Furnace, Boss Bandit, Musketeer, The Log, Elite Barbarians, Sparky, Skeleton Barrel, Prince;RangeBattle;Firecracker, Dark Prince, Cannon, Fireball, Witch, Void, Princess, Elixir Golem;RangeBattle;4;0;800;Tower Princess;4
2026-07-09;Reset;TOP_GLOBAL;#8R80R808;Gt_foresy;900;1;#L9VRJ;Calalas España;1;0;4;0;Mega Knight, Musketeer, Bats, Zap, Spear Goblins, Miner, Giant Snowball, Ram Rider;RangeBattle;Goblin Cage, Barbarian Barrel, Royal Recruits, Royal Hogs, Flying Machine, Zappies, Arrows, Electro Spirit;RangeBattle;Firecracker, Mighty Miner, Tesla, Hog Rider, Ice Spirit, Earthquake, Skeletons, The Log;Duelo;Skeleton Army, Goblins, Skeleton Barrel, Wall Breakers, Mini P.E.K.K.A, Vines, Dart Goblin, Princess;Duelo;4;0;900;Tower Princess;3
2026-07-09;Reset;TOP_GLOBAL;#2YU9228P;StarGrass;900;2;#L9VRJ;Calalas España;1;0;4;0;Royal Hogs, Royal Delivery, Archers, Baby Dragon, Tornado, Balloon, Lumberjack, Musketeer;RangeBattle;Goblin Barrel, Barbarian Barrel, Dart Goblin, Knight, Cannon, Princess, Goblin Gang, Ice Spirit;Duelo;Firecracker, Tesla, Valkyrie, Electro Spirit, Hog Rider, Skeletons, The Log, Earthquake;Duelo;Wall Breakers, Magic Archer, Goblin Cage, Goblin Giant, Mother Witch, Arrows, Guards, Fireball;RangeBattle;4;0;900;Tower Princess;3
2026-07-09;Reset;TOP_GLOBAL;#2LV8RL09J;Festinho 7;900;3;#L9VRJ;Calalas España;1;0;4;0;Royal Ghost, Magic Archer, P.E.K.K.A, Electro Wizard, Poison, Giant Snowball, Ram Rider, Dark Prince;RangeBattle;Skeleton Army, Fire Spirit, Zap, Inferno Tower, Prince, Elite Barbarians, Hog Rider, The Log;Duelo;Royal Recruits, Royal Hogs, Goblin Cage, Flying Machine, Zappies, Fireball, Electro Spirit, Arrows;Duelo;Lumberjack, Bowler, Electro Dragon, Freeze, Inferno Dragon, Tornado, Barbarian Barrel, Balloon;RangeBattle;4;0;900;Tower Princess;3
2026-07-09;Reset;TOP_GLOBAL;#2YCRCUGC9;teddy;900;4;#L9VRJ;Calalas España;1;0;4;0;Goblin Cage, Golden Knight, Bowler, Lightning, Inferno Dragon, Tornado, Bats, Electro Giant;RangeBattle;Skeleton Barrel, Mighty Miner, Royal Recruits, Firecracker, Arrows, Wall Breakers, Goblins, Goblin Gang;RangeBattle;Knight, Barbarian Barrel, Furnace, Poison, Ice Spirit, Berserker, Goblin Hut, Graveyard;Duelo;Royal Hogs, Ice Golem, Royal Ghost, Three Musketeers, The Log, Hunter, Fireball, Heal Spirit;Duelo;4;0;900;Tower Princess;3
2026-07-09;Reset;TOP_GLOBAL;#JGC2JG0;MuK｜⚡️Davidin⚡;900;1;#8UJ2UUJ8;#MuUuKaNs!!;2;0;4;0;Zap, Balloon, Valkyrie, Skeleton Dragons, Fireball, Guards, Inferno Dragon, Lava Hound;RangeBattle;Mega Knight, Archer Queen, Giant Snowball, Ram Rider, Lightning, Royal Ghost, Electro Spirit, Bandit;RangeBattle;Mortar, Skeleton King, Bats, Goblin Gang, Cannon Cart, Miner, Ice Wizard, Poison;Duelo;Royal Recruits, Barbarian Barrel, Goblin Cage, Zappies, Arrows, Royal Hogs, Flying Machine, Mother Witch;Duelo;4;0;900;Tower Princess;3
2026-07-09;Reset;TOP_GLOBAL;#2C2GUPPJG;MuK｜⚡Teo⚡;900;2;#8UJ2UUJ8;#MuUuKaNs!!;2;0;4;0;Wall Breakers, Magic Archer, Goblin Barrel, Valkyrie, Fire Spirit, Skeletons, Ice Spirit, Cannon;RangeBattle;Zap, Giant, Mini P.E.K.K.A, Bomber, Fireball, Dark Prince, Rage, Mega Minion;RangeBattle;Executioner, Boss Bandit, Giant Snowball, Ram Rider, Lightning, Royal Ghost, Bandit, Electro Spirit;Duelo;Knight, Barbarian Barrel, Goblin Cage, Graveyard, Baby Dragon, Poison, Ice Wizard, Tornado;Duelo;4;0;900;Tower Princess;3
2026-07-09;Reset;TOP_GLOBAL;#28GJPPGR;MuK｜⚡Axel™️⚡;900;3;#8UJ2UUJ8;#MuUuKaNs!!;2;0;4;0;Knight, Bowler, Giant Snowball, Graveyard, Ice Wizard, Tesla, Poison, Ice Spirit;RangeBattle;Valkyrie, Mega Minion, Goblin Cage, Lava Hound, Arrows, Guards, Lightning, Skeleton Dragons;RangeBattle;Executioner, Balloon, Zap, Giant Skeleton, Tombstone, Tornado, Zappies, Miner;Duelo;Mortar, Goblins, Skeleton Barrel, Rascals, Cannon Cart, Minions, Fireball, Barbarian Barrel;Duelo;4;0;900;Tower Princess;3
2026-07-09;Reset;TOP_GLOBAL;#29P0VGY8R;Terminator;900;4;#8UJ2UUJ8;#MuUuKaNs!!;2;0;4;0;Royal Recruits, Golden Knight, Goblin Cage, Zappies, Arrows, Bomber, Flying Machine, Royal Hogs;RangeBattle;;;;;;;1;0;200;Tower Princess;1
2026-07-09;Reset;TOP_GLOBAL;#2LURQR29;MuK｜⚡Chief 63⚡;900;5;#8UJ2UUJ8;#MuUuKaNs!!;2;0;4;0;Royal Recruits, Golden Knight, Goblin Cage, Barbarian Barrel, Zappies, Flying Machine, Fireball, Royal Hogs;RangeBattle;Mega Knight, Archer Queen, Bats, Wall Breakers, Zap, Miner, Prince, Goblin Gang;Duelo;Electro Dragon, Tornado, Barbarians, Battle Healer, Elixir Golem, Arrows, Rage, Phoenix;Duelo;P.E.K.K.A, Magic Archer, Battle Ram, Bandit, Royal Ghost, Poison, Vines, Electro Wizard;RangeBattle;4;0;900;Tower Princess;3
2026-07-09;Reset;TOP_GLOBAL;#J8QL9V2;AM ⚡️ Elite;900;1;#9U82JJ0Y;TheAddictedOnes;3;0;4;0;Giant Snowball, Knight, Tesla, Fire Spirit, Goblin Demolisher, Poison, Goblin Drill, Guards;RangeBattle;Firecracker, Mighty Miner, Cannon, The Log, Hog Rider, Skeletons, Ice Spirit, Earthquake;RangeBattle;Skeleton Barrel, Goblins, Wall Breakers, Rascals, Cannon Cart, Rocket, Arrows, Minions;Duelo;Goblin Barrel, Barbarian Barrel, Valkyrie, Dart Goblin, Goblin Gang, Princess, Inferno Tower, Electro Spirit;Duelo;4;0;900;Tower Princess;3
2026-07-09;Reset;TOP_GLOBAL;#88Q2YJ2Y;caveman13;900;2;#9U82JJ0Y;TheAddictedOnes;3;0;4;0;Witch, Giant, Giant Snowball, Minions, Arrows, Mini P.E.K.K.A, Bowler, Graveyard;RangeBattle;Battle Ram, Magic Archer, Royal Ghost, P.E.K.K.A, Electro Wizard, Bandit, Zap, Poison;RangeBattle;Royal Giant, Barbarian Barrel, Goblin Cage, Skeleton Dragons, Firecracker, Skeletons, Electro Spirit, Lightning;Duelo;Skeleton Barrel, Musketeer, Mortar, Knight, Fireball, Goblin Gang, The Log, Spear Goblins;Duelo;4;0;900;Tower Princess;3
2026-07-09;Reset;TOP_GLOBAL;#9LUQP8VL;Hagan;900;3;#9U82JJ0Y;TheAddictedOnes;3;0;4;0;Mega Knight, Mini P.E.K.K.A, Electro Dragon, Royal Giant, Fireball, Electro Spirit, Goblin Gang, Rage;RangeBattle;Firecracker, Tesla, Valkyrie, Earthquake, The Log, Skeletons, Hog Rider, Fire Spirit;RangeBattle;P.E.K.K.A, Magic Archer, Battle Ram, Bandit, Poison, Zap, Electro Wizard, Royal Ghost;Duelo;Ice Spirit, Ice Golem, Lumberjack, Arrows, Musketeer, Balloon, Minions, Royal Delivery;Duelo;4;0;900;Tower Princess;3
2026-07-09;Reset;TOP_GLOBAL;#2V0L20GPL;Connect | 여파;900;4;#9U82JJ0Y;TheAddictedOnes;3;0;4;0;Skeleton Barrel, Skeleton King, Mortar, Cannon Cart, Goblin Gang, Vines, Ice Wizard, The Log;RangeBattle;Battle Ram, Magic Archer, P.E.K.K.A, Lightning, Royal Ghost, Bandit, Minions, Zap;RangeBattle;Goblin Cage, Flying Machine, Royal Recruits, Fireball, Royal Hogs, Zappies, Arrows, Electro Spirit;Duelo;Furnace, Goblins, Knight, Graveyard, Poison, Goblin Hut, Ice Spirit, Barbarian Barrel;Duelo;4;0;900;Tower Princess;3
2026-07-09;Reset;TOP_GLOBAL;#209P8YQR;drixxeb;900;1;#9LVQLR;Band of Adultes;4;0;4;0;Witch, Mini P.E.K.K.A, Dart Goblin, Mega Minion, Giant Snowball, Bowler, Vines, Giant;RangeBattle;Valkyrie, Balloon, Lumberjack, Goblin Hut, Ice Wizard, Poison, Barbarian Barrel, Minions;RangeBattle;Skeletons, Skeleton King, Electro Dragon, Elixir Golem, Night Witch, Lightning, Tornado, Rage;Duelo;Furnace, Boss Bandit, Wall Breakers, Knight, Suspicious Bush, Spear Goblins, Royal Delivery, Cannon;Duelo;4;0;900;Tower Princess;3
2026-07-09;Reset;TOP_GLOBAL;#8R2L9C0P;♨️le tsar♨️;900;2;#9LVQLR;Band of Adultes;4;0;4;0;Inferno Dragon, Balloon, Lumberjack, Giant Skeleton, Goblin Gang, Dart Goblin, Freeze, Arrows;RangeBattle;Skeleton Barrel, Goblins, Mortar, Cannon Cart, Fireball, Minions, Rascals, Barbarian Barrel;Duelo;Skeleton Army, Giant, Minion Horde, Mini P.E.K.K.A, Zap, Sparky, Mother Witch, The Log;Duelo;Baby Dragon, Bowler, Goblin Cage, Electro Giant, Ronin, Lightning, Tornado, Fire Spirit;RangeBattle;4;0;900;Tower Princess;3
2026-07-09;Reset;TOP_GLOBAL;#88U20820U;TuRkoErTan66;900;3;#9LVQLR;Band of Adultes;4;0;4;0;Inferno Dragon, Ice Golem, Bowler, Skeleton Dragons, Tornado, Freeze, Goblin Cage, Graveyard;RangeBattle;Giant Snowball, Mighty Miner, Cannon, Bomber, Goblin Drill, Bats, Guards, Fire Spirit;RangeBattle;Royal Hogs, Archer Queen, Tesla, Earthquake, Ice Spirit, Goblins, Royal Delivery, The Log;Duelo;Royal Giant, Barbarian Barrel, Royal Ghost, Hunter, Fireball, Skeletons, Electro Spirit, Fisherman;Duelo;4;0;900;Tower Princess;3
2026-07-09;Reset;TOP_GLOBAL;#8J8VPG8VQ;✨️ManuBait✨️;900;4;#9LVQLR;Band of Adultes;4;0;4;0;Musketeer, Giant, Bowler, Graveyard, Giant Snowball, Arrows, Night Witch, Guards;RangeBattle;Royal Hogs, Wizard, Royal Ghost, Lightning, Barbarian Barrel, Skeletons, Ice Spirit, Goblin Hut;RangeBattle;Goblin Barrel, Knight, Skeleton Army, Wall Breakers, Dart Goblin, Princess, Electro Spirit, Cannon;Duelo;Mega Knight, Goblins, Bats, Skeleton Barrel, Miner, Spear Goblins, Goblin Gang, Suspicious Bush;Duelo;4;0;900;Tower Princess;3
2026-07-09;Reset;TOP_GLOBAL;#R02QQ0RGQ;Treplev;900;5;#9LVQLR;Band of Adultes;4;0;4;0;Valkyrie, Goblins, Goblin Cage, Zap, Spirit Empress, Fireball, Skeleton Dragons, Lava Hound;RangeBattle;Mortar, Spear Goblins, Skeleton Barrel, Barbarian Barrel, Cannon Cart, Minions, Rascals, Poison;Duelo;Dart Goblin, Knight, Goblin Barrel, Goblin Gang, Inferno Tower, Princess, Ice Spirit, The Log;Duelo;Cannon, Mighty Miner, Furnace, Lightning, Giant Snowball, Electro Spirit, Hog Rider, Skeletons;RangeBattle;4;0;900;Tower Princess;3
2026-07-09;Reset;TOP_GLOBAL;#CQRQVQRQY;P2W Evan;900;1;#P2P2Y880;! ShocK-13 !;5;0;4;0;Mortar, Goblins, Skeleton Barrel, Rascals, Cannon Cart, Barbarian Barrel, Minions, Fireball;RangeBattle;Firecracker, Knight, Tesla, The Log, Earthquake, Royal Delivery, Hog Rider, Skeletons;RangeBattle;Royal Recruits, Golden Knight, Royal Hogs, Goblin Cage, Flying Machine, Zappies, Arrows, Electro Spirit;Duelo;Battle Ram, Magic Archer, Royal Ghost, Bandit, Electro Wizard, Poison, P.E.K.K.A, Zap;Duelo;4;0;900;Tower Princess;3
2026-07-09;Reset;TOP_GLOBAL;#L8QJPVR0G;GS KLX;900;2;#P2P2Y880;! ShocK-13 !;5;0;4;0;Witch, Golden Knight, Skeleton King, Mini P.E.K.K.A, Executioner, Inferno Tower, Hog Rider, Fireball;RangeBattle;Royal Hogs, Mighty Miner, Musketeer, Dart Goblin, Royal Recruits, Dark Prince, Goblin Cage, Skeleton Barrel;RangeBattle;Wall Breakers, Bowler, Mega Minion, Mega Knight, Valkyrie, Tesla, Ram Rider, Berserker;Duelo;Knight, Balloon, Monk, Skeleton Army, Inferno Dragon, Freeze, Giant Skeleton, Furnace;Duelo;4;0;900;Tower Princess;3
2026-07-09;Reset;TOP_GLOBAL;#PV80LR2G8;GX 〆 Mømm¥ ツ;900;3;#P2P2Y880;! ShocK-13 !;5;0;4;0;Firecracker, Mighty Miner, Tesla, Goblins, Earthquake, Hog Rider, The Log, Ice Spirit;RangeBattle;Goblin Giant, Dark Prince, Zap, Electro Wizard, Minions, Sparky, Mini P.E.K.K.A, Rage;RangeBattle;;;;;2;0;400;Tower Princess;2
2026-07-09;Reset;TOP_GLOBAL;#YCUR9VCU;Lioon❤️PEEP;900;4;#P2P2Y880;! ShocK-13 !;5;0;4;0;;;;;;;;;0;0;0;Tower Princess;0
2026-07-09;Reset;TOP_GLOBAL;#G0C8V02;GS I Aearon;900;5;#P2P2Y880;! ShocK-13 !;5;0;4;0;Inferno Dragon, Magic Archer, Balloon, Lava Hound, Zap, Skeleton Dragons, Guards, Arrows;RangeBattle;Royal Giant, Wizard, Monk, Valkyrie, Giant Snowball, Fisherman, Electro Spirit, The Log;RangeBattle;Furnace, Bowler, Baby Dragon, Minions, Vines, Golem, Goblin Machine, Ronin;Duelo;Firecracker, Mighty Miner, Goblins, Royal Recruits, Wall Breakers, Fireball, Goblin Gang, Skeleton Barrel;Duelo;4;0;900;Tower Princess;3
2026-07-09;Reset;#2220UQQ0UU;#20UCVC0Q0Q;Hellboy01;2400;1;#R0JVY98R;BLACK「DR4GON;1;2400;16;0;Royal Recruits, Golden Knight, Skeleton King, Skeleton Army, Guards, Executioner, Three Musketeers, Skeletons;RangeBattle;Dart Goblin, Rocket, Witch, Golem, P.E.K.K.A, Ice Spirit, Bats, Barbarian Barrel;RangeBattle;Dark Prince, Berserker, Archers, Royal Giant, Lightning, Giant Skeleton, Electro Wizard, Bomber;RangeBattle;Sparky, Ice Wizard, Clone, Fireball, Electro Giant, Firecracker, Valkyrie, Mirror;RangeBattle;2;2;600;Tower Princess;4
2026-07-05;Dia 3;TOP_GLOBAL;#2P2PV98VJ;Excalibur;0;1;#L9VRJ;Calalas España;1;0;0;0;Royal Recruits, Barbarian Barrel, Firecracker, Flying Machine, Royal Hogs, Zappies, Fireball, Goblin Cage;RangeBattle;Royal Giant, Skeleton King, Witch, Fisherman, Electro Spirit, Lightning, The Log, Tombstone;Duelo;P.E.K.K.A, Magic Archer, Battle Ram, Zap, Bandit, Poison, Electro Wizard, Royal Ghost;Duelo;Valkyrie, Graveyard, Wizard, Guards, Bowler, Freeze, Tornado, Inferno Dragon;Duelo;0;3;300;Tower Princess;2
2026-07-05;Dia 3;TOP_GLOBAL;#8P0LR2YCJ;VEN EVOFQ 404CV;0;2;#L9VRJ;Calalas España;1;0;0;0;Electro Dragon, Wizard, Lumberjack, Golem, Barbarians, Skeleton Dragons, Battle Healer, Tornado;RangeBattle;Mega Knight, Archer Queen, Bats, Prince, Bandit, Goblin Gang, Wall Breakers, Zap;Duelo;Royal Hogs, Golden Knight, Royal Recruits, Goblin Cage, Flying Machine, Zappies, Fireball, Electro Spirit;Duelo;Goblin Giant, Boss Bandit, Archers, Sparky, Dark Prince, Minions, Arrows, Barbarian Barrel;Duelo;1;2;400;Tower Princess;2
2026-07-05;Dia 3;TOP_GLOBAL;#22CUVRCC;完成体❟❛❟Susanoo;0;3;#L9VRJ;Calalas España;1;0;0;0;Valkyrie, Barbarian Barrel, Wizard, Zappies, Bowler, Tornado, Freeze, Graveyard;RangeBattle;P.E.K.K.A, Dark Prince, Battle Ram, Electro Wizard, Zap, Fireball, Magic Archer, Bandit;RangeBattle;Royal Giant, Skeleton King, Witch, Tombstone, The Log, Lightning, Fisherman, Electro Spirit;Duelo;Mega Knight, Goblinstein, Firecracker, Wall Breakers, Arrows, Goblin Gang, Prince, Flying Machine;Duelo;0;4;400;Tower Princess;3
2026-07-05;Dia 3;TOP_GLOBAL;#2JJC0VC9;Buggato;0;4;#L9VRJ;Calalas España;1;0;0;0;Royal Recruits, Zappies, Firecracker, Fireball, The Log, Royal Hogs, Flying Machine, Goblin Cage;RangeBattle;Valkyrie, Guards, Wizard, Inferno Dragon, Bowler, Graveyard, Freeze, Tornado;RangeBattle;P.E.K.K.A, Golden Knight, Goblin Barrel, Poison, Princess, Magic Archer, Arrows, Goblin Gang;RangeBattle;Royal Giant, Skeleton King, Witch, Fisherman, Tombstone, Electro Spirit, Lightning, Barbarian Barrel;RangeBattle;4;0;800;Tower Princess;4
2026-07-05;Dia 3;TOP_GLOBAL;#2YRPUCLR9;✫ I ＳＮＩＰＥＲ™️✨;0;5;#L9VRJ;Calalas España;1;0;0;0;Mortar, Rascals, Bats, Arrows, Miner, Minions, Spear Goblins, Cannon Cart;RangeBattle;Valkyrie, Inferno Tower, Firecracker, Guards, Earthquake, The Log, Hog Rider, Ice Spirit;RangeBattle;Bomber, Goblins, Tesla, Wall Breakers, Poison, Goblin Drill, Knight, Giant Snowball;Duelo;Goblin Barrel, Mighty Miner, Skeleton Barrel, Cannon, Fireball, Goblin Gang, Dart Goblin, Princess;Duelo;3;1;800;Tower Princess;3
2026-07-05;Dia 3;TOP_GLOBAL;#P8P9LPG;~ASLAN~;0;1;#9U82JJ0Y;TheAddictedOnes;3;0;0;0;Cannon, Mighty Miner, Furnace, Electro Spirit, Hog Rider, Lightning, Skeletons, The Log;RangeBattle;P.E.K.K.A, Balloon, Electro Dragon, Barbarian Barrel, Lumberjack, Freeze, Ice Wizard, Tornado;Duelo;Baby Dragon, Mini P.E.K.K.A, Musketeer, Giant, Arrows, Giant Snowball, Graveyard, Bowler;Duelo;Goblin Cage, Zap, Valkyrie, Lava Hound, Miner, Minions, Spirit Empress, Fireball;Duelo;3;0;700;Tower Princess;2
2026-07-05;Dia 3;TOP_GLOBAL;#L2C8UJV8;Sword;0;2;#9U82JJ0Y;TheAddictedOnes;3;0;0;0;Goblin Barrel, Goblins, Valkyrie, Ice Spirit, Rocket, Wall Breakers, Dart Goblin, Fire Spirit;RangeBattle;Baby Dragon, Archer Queen, Goblin Cage, Electro Giant, Dark Prince, Lightning, Barbarian Barrel, Tornado;RangeBattle;Battle Ram, Wizard, Royal Ghost, Giant Skeleton, Mother Witch, Vines, Zappies, The Log;RangeBattle;Skeleton Barrel, Skeleton King, Mortar, Goblin Gang, Arrows, Cannon Cart, Minions, Ice Wizard;RangeBattle;0;4;400;Tower Princess;4
2026-07-05;Dia 3;TOP_GLOBAL;#JRRPP9GP;NL NSW PT❤️Lara;0;3;#9U82JJ0Y;TheAddictedOnes;3;0;0;0;;;;;;;;;0;0;0;Tower Princess;0
2026-07-05;Dia 3;TOP_GLOBAL;#9C2GG8RQJ;Just Awful;0;4;#9U82JJ0Y;TheAddictedOnes;3;0;0;0;Skeleton Barrel, Goblins, Skeleton King, Skeleton Army, Royal Delivery, Suspicious Bush, Mother Witch, Rascals;RangeBattle;Royal Recruits, Dark Prince, Goblin Barrel, Dart Goblin, Goblin Gang, Cannon Cart, Arrows, Princess;Duelo;Witch, Fisherman, Royal Giant, Electro Spirit, The Log, Guards, Lightning, Skeletons;Duelo;Battle Ram, Archer Queen, Barbarians, Bandit, Fireball, Heal Spirit, Royal Ghost, Elixir Collector;Duelo;2;1;600;Tower Princess;2
2026-07-05;Dia 3;TOP_GLOBAL;#JPQQVG80G;QJD;0;5;#9U82JJ0Y;TheAddictedOnes;3;0;0;0;;;;;;;;;0;0;0;Tower Princess;0
2026-07-05;Dia 3;TOP_GLOBAL;#8U9GP0;Jsf ❤️ Ballon;0;1;#9LVQLR;Band of Adultes;4;0;0;0;Tesla, Mighty Miner, Firecracker, Guards, Earthquake, Hog Rider, The Log, Fire Spirit;RangeBattle;Goblin Cage, Ice Golem, Zap, Balloon, Miner, Inferno Dragon, Mega Minion, Fireball;RangeBattle;Goblin Drill, Knight, Giant Snowball, Poison, Ice Spirit, Goblins, Goblin Demolisher, Cannon;RangeBattle;Hunter, Barbarian Barrel, Royal Ghost, Fisherman, Royal Giant, Lightning, Electro Spirit, Skeletons;RangeBattle;0;4;400;Tower Princess;4
2026-07-05;Dia 3;TOP_GLOBAL;#80PPP0LU;BoA THIBAUD;0;2;#9LVQLR;Band of Adultes;4;0;0;0;Skeleton Army, Skeleton King, Inferno Dragon, Golem, Night Witch, Goblin Curse, Miner, Zap;RangeBattle;Skeleton Barrel, Goblins, Royal Ghost, Wall Breakers, Dark Prince, Dart Goblin, Rascals, Arrows;Duelo;Royal Hogs, Archer Queen, Cannon, Ice Spirit, Royal Delivery, Earthquake, The Log, Skeletons;Duelo;;;0;3;300;Tower Princess;2
2026-07-05;Dia 3;TOP_GLOBAL;#8P2V9LJP;ROZE;0;3;#9LVQLR;Band of Adultes;4;0;0;0;Goblin Barrel, Goblins, Valkyrie, Wall Breakers, Princess, Dart Goblin, Ice Spirit, Cannon;RangeBattle;Battle Ram, Bowler, Lumberjack, Giant Skeleton, Mother Witch, Fisherman, Zappies, Arrows;Duelo;Skeleton Barrel, Barbarian Barrel, Mortar, Cannon Cart, Berserker, Fireball, Goblin Gang, Ice Wizard;Duelo;Firecracker, Knight, Tesla, Hog Rider, Earthquake, Skeletons, Royal Delivery, The Log;Duelo;0;3;300;Tower Princess;2
2026-07-05;Dia 3;TOP_GLOBAL;#P80CGQUU0;phénix;0;4;#9LVQLR;Band of Adultes;4;0;0;0;Inferno Dragon, Golden Knight, Bowler, Baby Dragon, Freeze, Tornado, Spirit Empress, Balloon;RangeBattle;Mega Knight, Archer Queen, Wall Breakers, Prince, Goblin Gang, Bandit, Arrows, Bats;Duelo;Wizard, Royal Ghost, Valkyrie, Battle Ram, P.E.K.K.A, Barbarian Barrel, Electro Wizard, Poison;Duelo;Firecracker, Goblin Cage, Royal Recruits, Flying Machine, Rocket, Goblin Hut, Royal Hogs, Fireball;Duelo;3;0;700;Tower Princess;2
2026-07-05;Dia 3;TOP_GLOBAL;#VQ8U2C82;easy mdr de ouf;0;5;#9LVQLR;Band of Adultes;4;0;0;0;Valkyrie, Wizard, Furnace, Lightning, Hog Rider, Guards, The Log, Ice Spirit;RangeBattle;Royal Giant, Skeleton King, Witch, Zappies, Fireball, Fisherman, Tombstone, Barbarian Barrel;Duelo;Inferno Dragon, Balloon, Skeleton Army, Giant Skeleton, Baby Dragon, Freeze, Arrows, Bats;Duelo;Electro Dragon, Golden Knight, Bowler, Executioner, Poison, Elixir Golem, Rocket, Tornado;RangeBattle;2;2;600;Tower Princess;3
2026-07-05;Dia 3;TOP_GLOBAL;#GU2GQL;Giga Affe;0;1;#P2P2Y880;! ShocK-13 !;5;0;0;0;Bats, Mighty Miner, Wall Breakers, Poison, Tombstone, The Log, Miner, Spear Goblins;RangeBattle;Electro Dragon, Elixir Golem, Bomber, Battle Healer, Mirror, Arrows, Rage, Phoenix;Duelo;Furnace, Skeleton Army, Minion Horde, Three Musketeers, Golem, Vines, Elixir Collector, Barbarians;Duelo;Valkyrie, Barbarian Barrel, Goblin Barrel, Inferno Tower, Princess, Rocket, Ice Spirit, Goblin Gang;Duelo;3;0;700;Tower Princess;2
