data_coleta;dia_batalha;conta_tipo;player_tag;player_nome;player_fame;player_posicao;clan_tag;clan_nome;clan_posicao;clan_fame;decks_usados;boat_attacks;deck_1;deck_1_tipo;deck_2;deck_2_tipo;deck_3;deck_3_tipo;deck_4;deck_4_tipo;war_vitorias;war_derrotas;war_medals;war_torre;war_battles_count
2026-06-04;Reset;#2QR292P;#2GR9VJ8V8;MAHDI CR7;100;2;#99V9V22C;IRAN SOLID;1;0;1;0;Goblins, Mega Minion, Elixir Collector, Baby Dragon, Golem, Night Witch, Lightning, The Log;RangeBattle;;;;;;;0;1;100;Tower Princess;1
2026-06-04;Reset;#2QR292P;#99Q09UCCP;⚡⚡Jhon⚡⚡;100;2;#LLJPJ2JQ;28 royale 29;2;0;1;0;Rocket, The Log, Princess, Valkyrie, Goblin Barrel, Guards, Electro Spirit, Inferno Tower;RangeBattle;;;;;;;0;1;100;Tower Princess;1
2026-06-04;Reset;#2QR292P;#CQJYV08QJ;wosito;200;1;#LLJPJ2JQ;28 royale 29;2;0;1;0;Minion Horde, Boss Bandit, Wizard, Tombstone, Baby Dragon, Bomber, Goblin Gang, Arrows;RangeBattle;;;;;;;1;0;200;Tower Princess;1
2026-06-04;Reset;#2QR292P;#VGLQQCLCL;ips;200;29;#QCLPL9VQ;Tropa Do Bruxo;4;0;0;0;Dart Goblin, Goblinstein, P.E.K.K.A, Fireball, Ram Rider, Minions, Cannon, Goblin Barrel;Duelo;Valkyrie, Musketeer, Lumberjack, Bomber, Hog Rider, Arrows, Suspicious Bush, Goblin Machine;Duelo;Wizard, Mini P.E.K.K.A, Firecracker, Knight, Royal Giant, Bats, Inferno Tower, Wall Breakers;Duelo;;;0;2;200;Tower Princess;1
2026-06-04;Reset;#2QR292P;#JC22Q0QL;JL;300;5;#GR8UGRVJ;peru;5;0;2;0;Valkyrie, Wizard, Musketeer, Golem, Cannon, Elite Barbarians, Freeze, Balloon;RangeBattle;Battle Ram, Knight, P.E.K.K.A, Zap, Dark Prince, Witch, Fireball, Inferno Tower;RangeBattle;;;;;1;1;300;Tower Princess;2
2026-06-04;Reset;#2QR292P;#2J82JYVRV;CalonSoler;450;3;#YYG9V0VC;Orcos Samurai;3;0;3;0;Wizard, Knight, Archers, Hog Rider, Tesla, Skeleton Army, Arrows, Guards;Duelo;Witch, Firecracker, Barbarians, Balloon, Zap, Goblin Barrel, Goblin Gang, Baby Dragon;Duelo;P.E.K.K.A, Royal Giant, Musketeer, Bomber, Valkyrie, Fireball, Fire Spirit, The Log;Duelo;;;0;2;200;Tower Princess;1
2026-06-04;Reset;#2QR292P;#CCRUUJ00;alexia;500;2;#YYG9V0VC;Orcos Samurai;3;0;4;0;Lumberjack, Giant, Magic Archer, Arrows, Baby Dragon, Guards, Berserker, Elite Barbarians;RangeBattle;Valkyrie, Bowler, Battle Ram, Dark Prince, The Log, Dart Goblin, Prince, Hunter;RangeBattle;P.E.K.K.A, Goblins, Witch, Skeleton Barrel, Goblin Gang, Zap, Knight, Fireball;Duelo;Mega Knight, Mega Minion, Electro Dragon, Hog Rider, Firecracker, Bandit, Mini P.E.K.K.A, Giant Snowball;Duelo;1;3;500;Tower Princess;3
2026-06-04;Reset;#2QR292P;#JVGU0Q2Y9;Salvix;600;1;#YYG9V0VC;Orcos Samurai;3;0;4;0;Valkyrie, Mega Knight, Skeleton King, Executioner, Electro Wizard, Princess, Firecracker, Elixir Golem;RangeBattle;Dart Goblin, Wizard, Magic Archer, Inferno Tower, Goblin Barrel, Skeleton Dragons, Prince, Ram Rider;RangeBattle;Royal Hogs, Dark Prince, Skeleton Barrel, Royal Ghost, Tesla, Minion Horde, Arrows, Elite Barbarians;RangeBattle;Archers, P.E.K.K.A, Mini P.E.K.K.A, Fireball, Baby Dragon, Skeleton Army, Knight, Witch;RangeBattle;2;2;600;Tower Princess;4
2026-06-04;Reset;#2QR292P;#V2CUPLURQ;Amiguito;600;2;#GR8UGRVJ;peru;5;0;4;0;Knight, Goblins, Royal Hogs, Prince, Dart Goblin, Tombstone, Firecracker, Skeleton Army;RangeBattle;Furnace, Bowler, Witch, Mega Knight, Fire Spirit, Spear Goblins, Ice Golem, Bats;RangeBattle;P.E.K.K.A, Magic Archer, Skeleton Barrel, Skeletons, Valkyrie, Giant Snowball, Cannon, Princess;RangeBattle;Royal Ghost, Boss Bandit, Wizard, Zap, Goblin Barrel, Guards, Mini P.E.K.K.A, Baby Dragon;RangeBattle;2;2;600;Tower Princess;4
2026-06-04;Reset;#2QR292P;#VV0R8PGC2;omega20;600;3;#GR8UGRVJ;peru;5;0;4;0;Royal Ghost, Miner, Golden Knight, Electro Wizard, Zap, Dark Prince, Wizard, Firecracker;RangeBattle;Balloon, Musketeer, Goblinstein, Berserker, Bomb Tower, Wall Breakers, Lightning, Archers;RangeBattle;Royal Delivery, Knight, Archer Queen, Ice Wizard, Mini P.E.K.K.A, Royal Hogs, Goblin Gang, Tesla;RangeBattle;Skeleton Barrel, Mighty Miner, Magic Archer, Barbarian Barrel, Valkyrie, Spear Goblins, Witch, Arrows;RangeBattle;2;2;600;Tower Princess;4
2026-06-04;Reset;#2QR292P;#9YCG2YRQG;jammyr;600;4;#GR8UGRVJ;peru;5;0;3;0;Mega Knight, Baby Dragon, Wizard, Arrows, Balloon, Inferno Dragon, Minion Horde, Skeleton Army;RangeBattle;Witch, Dart Goblin, Firecracker, Giant Skeleton, Royal Giant, Bomber, Knight, Mini P.E.K.K.A;Duelo;Goblin Cage, Golden Knight, Valkyrie, Musketeer, P.E.K.K.A, Skeleton Dragons, Dark Prince, Zap;Duelo;;;2;1;600;Tower Princess;2
2026-06-04;Reset;#2QR292P;#UYJ0YGYP;amir.cr7;800;1;#99V9V22C;IRAN SOLID;1;0;4;0;Firecracker, Musketeer, Dart Goblin, Mini P.E.K.K.A, Electro Giant, Cannon Cart, Wall Breakers, Minions;RangeBattle;Mega Knight, Wizard, Valkyrie, Balloon, Tesla, Royal Delivery, Rage, Goblin Gang;RangeBattle;Witch, Knight, Electro Dragon, Royal Giant, Bowler, The Log, Cannon, Goblin Barrel;Duelo;P.E.K.K.A, Zap, Executioner, Fireball, Hog Rider, Electro Wizard, Bandit, Royal Ghost;Duelo;3;1;800;Tower Princess;3
2026-06-04;Reset;#2QR292P;#L8GYPCRUJ;Efiend;800;1;#GR8UGRVJ;peru;5;0;4;0;P.E.K.K.A, Little Prince, Furnace, Inferno Tower, Ice Spirit, The Log, Bandit, Bats;RangeBattle;Valkyrie, Giant, Firecracker, Bomb Tower, Heal Spirit, Rage, Ram Rider, Bomber;Duelo;Mega Knight, Barbarian Barrel, Wizard, Tesla, Fire Spirit, Arrows, Guards, Zap;Duelo;Royal Recruits, Mega Minion, Witch, Cannon, Electro Spirit, Earthquake, Wall Breakers, Musketeer;Duelo;3;0;700;Tower Princess;2
2026-06-04;Reset;TOP_GLOBAL;#RLC0PC2R;ニカNika™;900;1;#L9VRJ;Calalas España;1;0;4;0;Witch, Bowler, Giant Snowball, Giant, Graveyard, Mini P.E.K.K.A, Minions, Arrows;RangeBattle;Battle Ram, Magic Archer, Royal Ghost, P.E.K.K.A, Poison, Electro Wizard, Bandit, Zap;RangeBattle;Skeleton Barrel, Goblins, Mortar, Cannon Cart, Fireball, Skeleton Dragons, Rascals, Barbarian Barrel;Duelo;Wall Breakers, Knight, Minion Horde, Miner, Princess, Goblin Gang, The Log, Inferno Tower;Duelo;4;0;900;Tower Princess;3
2026-06-04;Reset;TOP_GLOBAL;#LU0QVLUL;Grilletto;900;2;#L9VRJ;Calalas España;1;0;4;0;Bomber, Golem, Electro Dragon, Heal Spirit, Elite Barbarians, Baby Dragon, Lumberjack, Tornado;RangeBattle;Royal Recruits, Barbarian Barrel, Goblin Cage, Royal Hogs, Flying Machine, Fireball, Zappies, Electro Spirit;RangeBattle;Goblin Giant, Mini P.E.K.K.A, Zap, Electro Wizard, Rage, Sparky, Dark Prince, Phoenix;Duelo;Barbarians, Skeleton Dragons, Skeleton Barrel, Cannon Cart, Giant Skeleton, Arrows, Mother Witch, Clone;Duelo;4;0;900;Tower Princess;3
2026-06-04;Reset;TOP_GLOBAL;#20GQ9RLUJ;CAL Xervo;900;3;#L9VRJ;Calalas España;1;0;4;0;Firecracker, Ice Golem, Skeletons, Ice Spirit, Hog Rider, Earthquake, The Log, Bomb Tower;RangeBattle;Goblin Barrel, Goblins, Dart Goblin, Knight, Cannon, Giant Snowball, Rocket, Fire Spirit;RangeBattle;Royal Recruits, Barbarian Barrel, Royal Hogs, Fireball, Arrows, Zappies, Flying Machine, Goblin Cage;Duelo;Archers, Bats, Goblin Giant, Sparky, Dark Prince, Mini P.E.K.K.A, Rage, Elixir Collector;Duelo;4;0;900;Tower Princess;3
2026-06-04;Reset;TOP_GLOBAL;#G2GVQLQ9;Leica;900;4;#L9VRJ;Calalas España;1;0;4;0;Wall Breakers, Magic Archer, Bats, Miner, Bomb Tower, Berserker, Royal Delivery, Fire Spirit;RangeBattle;Firecracker, Tesla, Valkyrie, The Log, Earthquake, Skeletons, Hog Rider, Ice Spirit;RangeBattle;Skeleton Barrel, Barbarian Barrel, Mortar, Cannon Cart, Fireball, Minions, Rascals, Goblins;Duelo;Executioner, Golden Knight, Inferno Dragon, Graveyard, Bowler, Zappies, Freeze, Tornado;Duelo;4;0;900;Tower Princess;3
2026-06-04;Reset;TOP_GLOBAL;#2YCRCUGC9;teddy;900;5;#L9VRJ;Calalas España;1;0;4;0;Goblin Cage, Golden Knight, Bowler, Lightning, Inferno Dragon, Tornado, Bats, Electro Giant;RangeBattle;Skeleton Barrel, Mighty Miner, Royal Recruits, Firecracker, Arrows, Wall Breakers, Goblins, Goblin Gang;RangeBattle;Knight, Barbarian Barrel, Furnace, Poison, Ice Spirit, Berserker, Skeletons, Graveyard;Duelo;Royal Hogs, Ice Golem, Royal Ghost, Three Musketeers, The Log, Hunter, Fireball, Heal Spirit;Duelo;4;0;900;Tower Princess;3
2026-06-04;Reset;TOP_GLOBAL;#9YLQRJC;MuK｜⚡Re Fymo⚡;900;1;#8UJ2UUJ8;#MuUuKaNs!!;2;0;4;0;Royal Giant, Hunter, Royal Ghost, Barbarian Barrel, Fisherman, Electro Spirit, Skeletons, Fireball;RangeBattle;Mega Knight, Archer Queen, Wall Breakers, Bandit, Bats, Goblin Gang, Arrows, Prince;RangeBattle;Goblin Giant, Mini P.E.K.K.A, Zap, Minions, Electro Wizard, Sparky, Dark Prince, Rage;Duelo;Furnace, Mighty Miner, Goblins, Cannon, Ice Spirit, Hog Rider, The Log, Lightning;Duelo;4;0;900;Tower Princess;3
2026-06-04;Reset;TOP_GLOBAL;#GQCVU8UJ;MuK｜⚡Oracolo™⚡;900;2;#8UJ2UUJ8;#MuUuKaNs!!;2;0;4;0;Firecracker, Mighty Miner, Tesla, Hog Rider, Electro Spirit, The Log, Earthquake, Skeletons;RangeBattle;Royal Recruits, Barbarian Barrel, Goblin Cage, Fireball, Royal Hogs, Flying Machine, Zappies, Goblin Gang;RangeBattle;Goblin Drill, Knight, Giant Snowball, Goblins, Cannon, Poison, Ice Spirit, Furnace;Duelo;Barbarians, Boss Bandit, Battle Ram, Musketeer, Elixir Collector, Royal Ghost, Arrows, Heal Spirit;Duelo;4;0;900;Tower Princess;3
2026-06-04;Reset;TOP_GLOBAL;#J8LJU2PPJ;MuK｜Zlatan 2 ⚡️;900;3;#8UJ2UUJ8;#MuUuKaNs!!;2;0;4;0;Mega Knight, Archer Queen, Bats, Wall Breakers, Bandit, Prince, Zap, Miner;RangeBattle;Electro Dragon, Elixir Golem, Inferno Dragon, Battle Healer, Rage, Arrows, Elite Barbarians, Mirror;RangeBattle;Firecracker, Mighty Miner, Goblins, Ice Spirit, The Log, Earthquake, Bomb Tower, Hog Rider;Duelo;Bomber, Dark Prince, Goblin Cage, Phoenix, Tornado, Lightning, Barbarian Barrel, Electro Giant;Duelo;4;0;900;Tower Princess;3
2026-06-04;Reset;TOP_GLOBAL;#CJ9G8PPPY;MuK｜⚡MiniAlex™⚡;900;4;#8UJ2UUJ8;#MuUuKaNs!!;2;0;4;0;Royal Giant, Wizard, Royal Ghost, Skeletons, Fireball, Fisherman, Barbarian Barrel, Electro Spirit;RangeBattle;Valkyrie, Goblins, Executioner, Ice Spirit, Hog Rider, Rocket, Tornado, The Log;RangeBattle;Mega Knight, Archer Queen, Bats, Wall Breakers, Prince, Bandit, Goblin Gang, Arrows;Duelo;Goblin Giant, Mini P.E.K.K.A, Zap, Rage, Minions, Mother Witch, Sparky, Dark Prince;Duelo;4;0;900;Tower Princess;3
2026-06-04;Reset;TOP_GLOBAL;#P0UJC8LJJ;Lucaさん⚡️;900;5;#8UJ2UUJ8;#MuUuKaNs!!;2;0;4;0;Goblin Giant, Mini P.E.K.K.A, Zap, Minions, Rage, Sparky, Dark Prince, Electro Wizard;RangeBattle;Mega Knight, Archer Queen, Wall Breakers, Arrows, Prince, Bandit, Goblin Gang, Bats;RangeBattle;Executioner, Boss Bandit, Royal Ghost, Guards, Barbarian Barrel, Lightning, Giant Snowball, Ram Rider;Duelo;Firecracker, Mighty Miner, Tesla, Skeletons, Ice Spirit, The Log, Hog Rider, Earthquake;Duelo;4;0;900;Tower Princess;3
2026-06-04;Reset;TOP_GLOBAL;#CUJQJ9L0G;奧利佛;900;1;#9U82JJ0Y;TheAddictedOnes;3;0;4;0;Baby Dragon, Mini P.E.K.K.A, Witch, Elixir Collector, Berserker, Barbarian Barrel, Golem, Vines;RangeBattle;Mortar, Skeleton King, Skeleton Barrel, Musketeer, Minions, Goblin Gang, Fireball, The Log;RangeBattle;Royal Ghost, Golden Knight, Battle Ram, P.E.K.K.A, Mother Witch, Electro Wizard, Guards, Zap;Duelo;Goblin Cage, Wizard, Royal Recruits, Royal Hogs, Flying Machine, Poison, Arrows, Electro Spirit;Duelo;4;0;900;Tower Princess;3
2026-06-04;Reset;TOP_GLOBAL;#YGJ8UR8V;Btwags;900;2;#9U82JJ0Y;TheAddictedOnes;3;0;4;0;Goblin Giant, Ice Golem, Barbarians, Night Witch, Tornado, Rage, Vines, Executioner;RangeBattle;Tesla, Knight, Princess, Ice Spirit, The Log, Goblin Barrel, Rocket, Goblin Gang;RangeBattle;Valkyrie, Goblins, Mortar, Void, Musketeer, Fireball, Barbarian Barrel, Phoenix;Duelo;Skeleton Army, Skeleton King, Minion Horde, Wizard, Arrows, Freeze, Lumberjack, P.E.K.K.A;Duelo;4;0;900;Tower Princess;3
2026-06-04;Reset;TOP_GLOBAL;#9QUVUL2LL;Captain Levi;900;3;#9U82JJ0Y;TheAddictedOnes;3;0;4;0;Battle Ram, Bandit, Wizard, Tesla, Zap, Electro Wizard, P.E.K.K.A, Fireball;RangeBattle;Witch, Mega Minion, Lumberjack, Arrows, Cannon, Golem, Mini P.E.K.K.A, Lightning;RangeBattle;;;;;2;0;400;Tower Princess;2
2026-06-04;Reset;TOP_GLOBAL;#RR9L9YQ0;AM ⚡ Miki;900;4;#9U82JJ0Y;TheAddictedOnes;3;0;4;0;Skeleton Army, Skeleton King, Inferno Dragon, Golem, Night Witch, Elixir Golem, Rage, Arrows;RangeBattle;Furnace, Knight, Goblin Cage, Barbarian Barrel, Graveyard, Ice Wizard, Giant Snowball, Poison;RangeBattle;Ice Spirit, Balloon, Lumberjack, Minions, Bowler, Mother Witch, Tornado, Freeze;Duelo;Firecracker, Goblins, Mortar, Hog Rider, Musketeer, Ice Golem, Fireball, The Log;Duelo;4;0;900;Tower Princess;3
2026-06-04;Reset;TOP_GLOBAL;#LUUY9LJP;Diablo;900;5;#9U82JJ0Y;TheAddictedOnes;3;0;4;0;Skeleton Barrel, Bowler, Royal Ghost, Miner, Zap, Rascals, Electro Wizard, Poison;RangeBattle;Mortar, Knight, Skeleton Army, Mini P.E.K.K.A, Giant Snowball, Spear Goblins, Dart Goblin, Lightning;RangeBattle;Electro Dragon, Goblinstein, Mega Knight, Barbarian Barrel, Guards, Battle Healer, Tornado, Hog Rider;Duelo;Royal Recruits, Balloon, Lumberjack, Arrows, Goblin Hut, Zappies, Goblin Gang, Fireball;Duelo;4;0;900;Tower Princess;3
2026-06-04;Reset;TOP_GLOBAL;#8U9GP0;Jsf ❤️ Ballon;900;1;#9LVQLR;Band of Adultes;5;0;4;0;Goblin Cage, Ice Golem, Zap, Balloon, Miner, Inferno Dragon, Mega Minion, Fireball;RangeBattle;Goblin Drill, Knight, Giant Snowball, Poison, Ice Spirit, Goblins, Goblin Demolisher, Cannon;RangeBattle;Tesla, Mighty Miner, Firecracker, Guards, Earthquake, Hog Rider, The Log, Fire Spirit;Duelo;Hunter, Barbarian Barrel, Royal Ghost, Fisherman, Royal Giant, Lightning, Electro Spirit, Skeletons;Duelo;4;0;900;Tower Princess;3
2026-06-04;Reset;TOP_GLOBAL;#9GPR8R98;Games90;900;2;#9LVQLR;Band of Adultes;5;0;4;0;Minion Horde, Goblins, Zap, Goblin Demolisher, Goblin Curse, Miner, Phoenix, Bandit;RangeBattle;Wall Breakers, Wizard, Skeleton Barrel, Royal Ghost, Arrows, Berserker, Cannon, Dart Goblin;RangeBattle;Royal Giant, Golden Knight, Barbarian Barrel, Guards, Void, Spirit Empress, Minions, Rage;Duelo;Bomber, Ice Golem, Balloon, Skeletons, Freeze, Mega Minion, Musketeer, Giant Snowball;Duelo;4;0;900;Tower Princess;3
2026-06-04;Reset;TOP_GLOBAL;#2JJP80R;Phoenix38;900;3;#9LVQLR;Band of Adultes;5;0;4;0;Royal Recruits, Golden Knight, Goblin Cage, Zappies, Poison, Royal Hogs, Flying Machine, Berserker;RangeBattle;Skeleton Barrel, Musketeer, Mortar, Minions, Rascals, Goblin Gang, Cannon Cart, Void;RangeBattle;Mega Knight, Barbarian Barrel, Royal Ghost, Ram Rider, Spirit Empress, Furnace, Zap, Fireball;Duelo;Battle Ram, Magic Archer, P.E.K.K.A, Mother Witch, Goblins, Electro Wizard, Bandit, Arrows;Duelo;4;0;900;Tower Princess;3
2026-06-04;Reset;TOP_GLOBAL;#QJU8V8U8;筽❤️M0_COSTA;900;4;#9LVQLR;Band of Adultes;5;0;4;0;Battle Ram, Magic Archer, Royal Ghost, Bandit, Electro Wizard, P.E.K.K.A, Arrows, Giant Snowball;RangeBattle;Furnace, Bowler, Knight, Poison, Barbarian Barrel, Skeletons, Graveyard, Goblin Hut;RangeBattle;Valkyrie, Balloon, Mega Minion, Lava Hound, Inferno Dragon, Guards, Fireball, Zap;Duelo;Minion Horde, Mini P.E.K.K.A, Giant, Zappies, Mother Witch, Heal Spirit, Rage, Dark Prince;Duelo;4;0;900;Tower Princess;3
2026-06-04;Reset;TOP_GLOBAL;#2CCLLL09;Max la Menace;900;5;#9LVQLR;Band of Adultes;5;0;4;0;Goblin Drill, Knight, Magic Archer, Tesla, Goblin Demolisher, Skeletons, Tornado, The Log;RangeBattle;Mortar, Bowler, Skeleton Barrel, Fireball, Minions, Arrows, Rascals, Dart Goblin;RangeBattle;Royal Ghost, Ice Golem, Royal Hogs, Zap, Poison, Three Musketeers, Heal Spirit, Hunter;Duelo;Executioner, Balloon, Witch, Miner, Bomb Tower, Goblins, Giant Snowball, Lumberjack;Duelo;4;0;900;Tower Princess;3
