data_coleta;dia_batalha;conta_tipo;player_tag;player_nome;player_fame;player_posicao;clan_tag;clan_nome;clan_posicao;clan_fame;decks_usados;boat_attacks;deck_1;deck_1_tipo;deck_2;deck_2_tipo;deck_3;deck_3_tipo;deck_4;deck_4_tipo;war_vitorias;war_derrotas;war_medals;war_torre;war_battles_count
2026-06-11;Reset;#2QR292P;#PU0GLV2J9;izT-brandon-_-;75;4;#GR8UGRVJ;peru;5;0;1;1;Firecracker, Bowler, Mini P.E.K.K.A, Knight, Witch, Inferno Dragon, The Log, Goblin Gang;Barco;;;;;;;0;1;75;Tower Princess;1
2026-06-11;Reset;#2QR292P;#2VQL08V9V;sandia;100;5;#YYG9V0VC;Orcos Samurai;3;0;1;0;Royal Giant, Inferno Tower, Fire Spirit, Poison, Magic Archer, Princess, Sparky, Ice Spirit;RangeBattle;;;;;;;0;1;100;Tower Princess;1
2026-06-11;Reset;#2QR292P;#299V0CVJC;Geova;200;2;#LLJPJ2JQ;28 royale 29;2;0;1;0;Inferno Dragon, Baby Dragon, Goblin Cage, Executioner, Mother Witch, Elixir Golem, Tornado, Fireball;RangeBattle;;;;;;;1;0;200;Tower Princess;1
2026-06-11;Reset;#2QR292P;#8PY0G8G8;Willy;200;4;#YYG9V0VC;Orcos Samurai;3;0;2;2;Valkyrie, Earthquake, Princess, Barbarians, Hog Rider, Barbarian Hut, Sparky, Witch;Barco;Three Musketeers, Bomber, Barbarian Barrel, Dark Prince, Bomb Tower, Rocket, Royal Hogs, Elixir Collector;Barco;;;;;1;1;200;Tower Princess;2
2026-06-11;Reset;#2QR292P;#GGV0U2UPQ;cratos;275;1;#QCLPL9VQ;Tropa Do Bruxo;4;0;3;3;Barbarians, Royal Ghost, Electro Wizard, Hunter, Ice Wizard, Royal Hogs, Balloon, Dart Goblin;Barco;Musketeer, Golden Knight, Mini P.E.K.K.A, Skeleton Dragons, Baby Dragon, Hog Rider, Elixir Golem, Skeleton Barrel;Barco;Firecracker, Princess, Mega Knight, Executioner, Witch, Tombstone, Clone, Valkyrie;Barco;;;1;2;275;Tower Princess;3
2026-06-11;Reset;#2QR292P;#UYJ0YGYP;amir.cr7;325;5;#99V9V22C;IRAN SOLID;1;0;0;0;Valkyrie, Balloon, Mini P.E.K.K.A, Wizard, Electro Giant, Electro Wizard, Executioner, P.E.K.K.A;Barco;Hog Rider, Bowler, Musketeer, Mega Knight;Barco;;;;;2;1;325;Tower Princess;3
2026-06-11;Reset;#2QR292P;#88JYV08L;Kzduardo;325;13;#QCLPL9VQ;Tropa Do Bruxo;4;0;0;0;Elite Barbarians, Bomber, Dart Goblin, Firecracker, Royal Recruits, Goblin Gang, Flying Machine, Goblin Hut;Barco;Knight, Fire Spirit, Barbarian Hut, Wizard;Barco;;;;;2;1;325;Tower Princess;3
2026-06-11;Reset;#2QR292P;#JJ92QL9Q2;Baldolino87;450;3;#GR8UGRVJ;peru;5;0;4;4;Clone, Fireball, Mirror, Executioner, Magic Archer, Royal Recruits, Three Musketeers, Elite Barbarians;Barco;Firecracker, Boss Bandit, Archer Queen, Valkyrie, Goblin Gang, Goblin Giant, Minion Horde, Guards;Barco;Knight, Mega Knight, Electro Giant, Giant Skeleton, Skeleton Dragons, Sparky, Rascals, Rocket;Barco;P.E.K.K.A, Wizard, Princess, Bowler, Mini P.E.K.K.A, Witch, Dart Goblin, Balloon;Barco;3;1;450;Tower Princess;4
2026-06-11;Reset;#2QR292P;#8VC2VLUC2;vahid;550;3;#99V9V22C;IRAN SOLID;1;0;4;0;Valkyrie, Firecracker, Fire Spirit, Dark Prince, Elite Barbarians, Royal Recruits, Goblin Gang, Baby Dragon;RangeBattle;Archers, Boss Bandit, Electro Giant, Hunter, Minions, Zap, Guards, Furnace;Duelo;Mega Knight, Wizard, Balloon, Minion Horde, Witch, Fireball, Freeze, Prince;Duelo;P.E.K.K.A, Lumberjack, Dart Goblin, Arrows, Electro Wizard, Poison, Executioner, Rage;Duelo;2;1;600;Tower Princess;2
2026-06-11;Reset;#2QR292P;#PPG8JCQRG;Ridk;600;1;#LLJPJ2JQ;28 royale 29;2;0;4;0;Mega Knight, Giant Skeleton, Barbarians, Furnace, Spear Goblins, Minion Horde, Elixir Collector, Magic Archer;RangeBattle;P.E.K.K.A, Wizard, Archers, Hunter, Fireball, Bats, Knight, Guards;RangeBattle;Royal Ghost, Dark Prince, Executioner, Princess, Elixir Golem, Baby Dragon, Hog Rider, Golem;RangeBattle;Prince, Witch, Valkyrie, Ice Wizard, Inferno Dragon, Dart Goblin, Skeleton Army, Arrows;RangeBattle;2;2;600;Tower Princess;4
2026-06-11;Reset;#2QR292P;#JVGU0Q2Y9;Salvix;600;3;#YYG9V0VC;Orcos Samurai;3;0;4;0;Valkyrie, Mega Knight, Skeleton King, Executioner, Electro Wizard, Princess, Firecracker, Elixir Golem;RangeBattle;Dart Goblin, Wizard, Magic Archer, Inferno Tower, Goblin Barrel, Skeleton Dragons, Prince, Ram Rider;RangeBattle;Royal Hogs, Dark Prince, Skeleton Barrel, Royal Ghost, Tesla, Minion Horde, Arrows, Elite Barbarians;RangeBattle;Archers, P.E.K.K.A, Mini P.E.K.K.A, Fireball, Baby Dragon, Skeleton Army, Knight, Witch;RangeBattle;2;2;600;Tower Princess;4
2026-06-11;Reset;#2QR292P;#V2CUPLURQ;Amiguito;600;1;#GR8UGRVJ;peru;5;0;4;0;Knight, Goblins, Royal Hogs, Prince, Dart Goblin, Tombstone, Firecracker, Skeleton Army;RangeBattle;Furnace, Bowler, Witch, Mega Knight, Fire Spirit, Spear Goblins, Ice Golem, Bats;RangeBattle;P.E.K.K.A, Magic Archer, Skeleton Barrel, Skeletons, Valkyrie, Giant Snowball, Cannon, Princess;RangeBattle;Royal Ghost, Boss Bandit, Wizard, Zap, Goblin Barrel, Guards, Mini P.E.K.K.A, Baby Dragon;RangeBattle;2;2;600;Tower Princess;4
2026-06-11;Reset;#2QR292P;#J8Y9QY8UV;chipilin;600;2;#GR8UGRVJ;peru;5;0;4;0;Witch, Knight, Skeleton Barrel, Elite Barbarians, Flying Machine, Goblin Cage, Musketeer, Mini P.E.K.K.A;RangeBattle;Executioner, Electro Wizard, Dart Goblin, Wall Breakers, Giant Skeleton, Hog Rider, Mirror, Inferno Tower;RangeBattle;Firecracker, Barbarian Barrel, Lumberjack, Tesla, Ice Golem, Arrows, Princess, Electro Giant;RangeBattle;Valkyrie, Furnace, Mega Knight, Goblin Barrel, Berserker, Elixir Golem, Cannon, Goblin Gang;RangeBattle;2;2;600;Tower Princess;4
2026-06-11;Reset;#2QR292P;#2GLGURJCL;PTV_gravity;650;2;#YYG9V0VC;Orcos Samurai;3;0;4;0;Dart Goblin, Bomber, Royal Ghost, Minions, Prince, Skeleton Dragons, Ice Wizard, Fireball;RangeBattle;Valkyrie, Musketeer, Witch, Baby Dragon, Hog Rider, Electro Wizard, The Log, Princess;Duelo;Knight, Bats, Royal Hogs, Skeleton Army, Dark Prince, Electro Dragon, Magic Archer, Hunter;Duelo;Wizard, Firecracker, Mega Minion, Balloon, Flying Machine, Night Witch, Guards, Furnace;Duelo;1;2;400;Tower Princess;2
2026-06-11;Reset;#2QR292P;#LC90JC98;cristian;700;1;#YYG9V0VC;Orcos Samurai;3;0;4;0;Firecracker, Little Prince, Electro Dragon, Mega Knight, Musketeer, Hog Rider, Zap, Ram Rider;RangeBattle;Archers, Executioner, Royal Giant, Witch, P.E.K.K.A, Valkyrie, Skeleton Army, Wall Breakers;RangeBattle;Golem, Arrows, Skeleton Barrel, Wizard, Magic Archer, Dart Goblin, Mini P.E.K.K.A, Poison;RangeBattle;Giant, Princess, Goblin Gang, Goblin Barrel, Bomber, Sparky, Inferno Dragon, Bats;RangeBattle;3;1;700;Tower Princess;4
2026-06-11;Reset;TOP_GLOBAL;#R8UQUC0U;〔ĶЌĶ〕• ADONIS M;800;4;#L9VRJ;Calalas España;1;0;4;0;Royal Giant, Wizard, Goblin Cage, Firecracker, Fireball, Goblins, Zap, Fisherman;RangeBattle;Furnace, Mighty Miner, Cannon, Hog Rider, Earthquake, Skeletons, The Log, Ice Spirit;Duelo;Tesla, Magic Archer, Royal Hogs, Lightning, Dark Prince, Barbarian Barrel, Electro Spirit, Berserker;Duelo;Witch, Bowler, Giant Snowball, Mini P.E.K.K.A, Giant, Arrows, Graveyard, Minions;Duelo;3;0;700;Tower Princess;2
2026-06-11;Reset;TOP_GLOBAL;#8C2LCCVP;Ve2 I ☢️markez☢;800;5;#L9VRJ;Calalas España;1;0;4;0;Skeleton Barrel, Magic Archer, Barbarians, Clone, Earthquake, Flying Machine, Giant Skeleton, Skeleton Dragons;RangeBattle;Mega Knight, Archer Queen, Wall Breakers, Giant Snowball, Minions, Vines, Prince, Miner;RangeBattle;Royal Recruits, Wizard, Goblin Cage, Arrows, Zappies, Fireball, Royal Hogs, Electro Spirit;Duelo;Electro Dragon, Monk, Inferno Dragon, Zap, Tornado, Battle Healer, Elixir Golem, Rage;Duelo;3;1;800;Tower Princess;3
2026-06-11;Reset;TOP_GLOBAL;#QV22080;porcello;800;4;#8UJ2UUJ8;#MuUuKaNs!!;2;0;4;0;Goblin Barrel, Knight, Dart Goblin, Goblin Gang, The Log, Princess, Ice Spirit, Inferno Tower;RangeBattle;P.E.K.K.A, Magic Archer, Battle Ram, Royal Ghost, Bandit, Electro Wizard, Zap, Poison;Duelo;Royal Recruits, Barbarian Barrel, Goblin Cage, Flying Machine, Zappies, Fireball, Electro Spirit, Royal Hogs;Duelo;Mega Knight, Archer Queen, Bats, Arrows, Guards, Miner, Prince, Wall Breakers;Duelo;3;0;700;Tower Princess;2
2026-06-11;Reset;TOP_GLOBAL;#89CRURJP;Lucax;800;5;#8UJ2UUJ8;#MuUuKaNs!!;2;0;4;0;Dart Goblin, Giant Snowball, Goblin Barrel, Rocket, Princess, Dark Prince, Rascals, Guards;RangeBattle;Knight, Barbarian Barrel, Goblin Cage, Poison, Baby Dragon, Tornado, Ice Wizard, Graveyard;Duelo;Skeletons, Ice Golem, Musketeer, Fireball, Hog Rider, Ice Spirit, Cannon, The Log;Duelo;Wall Breakers, Archer Queen, Mega Knight, Bandit, Prince, Bats, Goblin Gang, Arrows;Duelo;3;0;700;Tower Princess;2
2026-06-11;Reset;TOP_GLOBAL;#Q8LC888Y;Carnagal;800;2;#9LVQLR;Band of Adultes;5;0;4;0;Battle Ram, Golden Knight, Mega Knight, Bandit, Arrows, Mother Witch, Electro Wizard, Skeleton Dragons;RangeBattle;Bomber, Balloon, Baby Dragon, Lumberjack, Berserker, Tornado, Electro Spirit, Freeze;Duelo;Mortar, Goblins, Skeleton Barrel, Cannon Cart, Fireball, Barbarian Barrel, Rascals, Minions;Duelo;Wall Breakers, Knight, Minion Horde, Miner, Inferno Tower, Princess, Goblin Gang, The Log;Duelo;3;0;700;Tower Princess;2
2026-06-11;Reset;TOP_GLOBAL;#JPLYJPQL2;〖Paͥlmͣeͫ〗;800;3;#9LVQLR;Band of Adultes;5;0;4;0;Goblin Giant, Dark Prince, Zap, Elite Barbarians, Sparky, Electro Wizard, Heal Spirit, Rage;RangeBattle;Royal Recruits, Goblin Cage, Royal Hogs, Zappies, Fireball, Electro Spirit, Flying Machine, Arrows;Duelo;Lumberjack, Archer Queen, Mega Knight, Goblins, Lightning, Ram Rider, Bomber, Giant Snowball;Duelo;Knight, Barbarian Barrel, Furnace, Poison, Goblin Hut, Graveyard, Berserker, Ice Wizard;Duelo;3;0;700;Tower Princess;2
2026-06-11;Reset;TOP_GLOBAL;#LYYGJ8L2;arwene;800;4;#9LVQLR;Band of Adultes;5;0;4;0;Goblin Cage, Golden Knight, Inferno Dragon, Bowler, Tornado, Electro Giant, Lightning, Bomber;RangeBattle;Valkyrie, Mini P.E.K.K.A, Baby Dragon, Vines, Zappies, Golem, Elixir Collector, Battle Healer;RangeBattle;Mortar, Goblins, Skeleton Barrel, Minions, The Log, Cannon Cart, Fireball, Rascals;Duelo;Furnace, Dark Prince, Knight, Graveyard, Poison, Goblin Hut, Spirit Empress, Barbarian Barrel;Duelo;3;1;800;Tower Princess;3
2026-06-11;Reset;TOP_GLOBAL;#29VPY2Y2Y;『αℓ』;800;5;#9LVQLR;Band of Adultes;5;0;4;0;Mega Knight, Balloon, Lumberjack, Spirit Empress, Fireball, Zap, Minions, Goblins;RangeBattle;Battle Ram, Wizard, Royal Ghost, Giant Skeleton, Mother Witch, Vines, Zappies, Barbarian Barrel;Duelo;Baby Dragon, Mega Minion, Valkyrie, Lava Hound, Lightning, Guards, Arrows, Tombstone;Duelo;Furnace, Bowler, Tesla, Graveyard, Poison, Skeletons, Ice Spirit, Knight;Duelo;3;0;700;Tower Princess;2
2026-06-11;Reset;#2QR292P;#CL80Y2GLU;ghazaleh;800;1;#99V9V22C;IRAN SOLID;1;0;4;0;Firecracker, Boss Bandit, Royal Ghost, P.E.K.K.A, Minions, Inferno Tower, Skeleton Army, Royal Hogs;RangeBattle;Witch, Executioner, Royal Giant, Arrows, Battle Ram, Bomber, Princess, Skeleton Barrel;RangeBattle;Archers, Ram Rider, Furnace, Hog Rider, Mega Knight, Guards, Wall Breakers, Dart Goblin;RangeBattle;Valkyrie, Wizard, Elite Barbarians, Bandit, Goblin Gang, Goblin Barrel, Zap, Tornado;RangeBattle;4;0;800;Tower Princess;4
2026-06-11;Reset;#2QR292P;#2GR9VJ8V8;MAHDI CR7;800;2;#99V9V22C;IRAN SOLID;1;0;4;0;Skeleton Barrel, Skeleton King, Musketeer, Tombstone, Fireball, Zap, Firecracker, Cannon;RangeBattle;Princess, Barbarian Barrel, Knight, Goblin Barrel, Rocket, Inferno Tower, Ice Spirit, Goblin Gang;Duelo;Baby Dragon, Mega Minion, Goblins, Elixir Collector, Golem, Night Witch, Lightning, The Log;Duelo;Lumberjack, Balloon, Barbarians, Mother Witch, Bats, Clone, Flying Machine, Giant Skeleton;Duelo;3;0;700;Tower Princess;2
2026-06-11;Reset;TOP_GLOBAL;#2Y8G8R0QR;<c2>Gorka;900;1;#L9VRJ;Calalas España;1;0;4;0;Mega Knight, Archer Queen, Wall Breakers, Prince, Minions, Arrows, Zap, Bandit;RangeBattle;Lumberjack, Balloon, Electro Dragon, Baby Dragon, Giant Snowball, Tornado, Bowler, Freeze;RangeBattle;Cannon, Ice Golem, Musketeer, Fireball, The Log, Hog Rider, Skeletons, Ice Spirit;Duelo;Royal Giant, Monk, Royal Ghost, Barbarian Barrel, Fisherman, Electro Spirit, Hunter, Rage;Duelo;4;0;900;Tower Princess;3
2026-06-11;Reset;TOP_GLOBAL;#9VYU99UR;ᵏˡⁿMÂŠTÊR_ØNĘᵃᵏ;900;2;#L9VRJ;Calalas España;1;0;4;0;Witch, Bowler, Giant, Graveyard, Mini P.E.K.K.A, Giant Snowball, Minions, Void;RangeBattle;Battle Ram, Magic Archer, Dark Prince, Giant Skeleton, Royal Ghost, Mother Witch, Vines, Goblins;RangeBattle;Royal Hogs, Barbarian Barrel, Goblin Cage, Royal Recruits, Fireball, Zappies, Flying Machine, Arrows;Duelo;Mega Knight, Wizard, Furnace, Prince, Wall Breakers, Bandit, Goblin Gang, The Log;Duelo;4;0;900;Tower Princess;3
2026-06-11;Reset;TOP_GLOBAL;#LU0QVLUL;Grilletto;900;3;#L9VRJ;Calalas España;1;0;4;0;Barbarians, Skeleton Dragons, Skeleton Barrel, Cannon Cart, Giant Skeleton, Arrows, Mother Witch, Clone;RangeBattle;Bomber, Golem, Electro Dragon, Heal Spirit, Elite Barbarians, Baby Dragon, Lumberjack, Tornado;RangeBattle;Goblin Giant, Mini P.E.K.K.A, Zap, Electro Wizard, Rage, Sparky, Dark Prince, Phoenix;Duelo;Royal Recruits, Barbarian Barrel, Goblin Cage, Royal Hogs, Flying Machine, Fireball, Zappies, Electro Spirit;Duelo;4;0;900;Tower Princess;3
2026-06-11;Reset;TOP_GLOBAL;#2RL2UU8V;DELU_02;900;1;#8UJ2UUJ8;#MuUuKaNs!!;2;0;4;0;Wall Breakers, Musketeer, Mega Knight, Miner, Prince, Minions, Zap, Goblin Gang;RangeBattle;Firecracker, Mighty Miner, Tesla, Earthquake, The Log, Hog Rider, Ice Spirit, Skeletons;RangeBattle;Lumberjack, Barbarian Barrel, Electro Dragon, Battle Healer, Tornado, Baby Dragon, Golem, Mega Minion;Duelo;Battle Ram, Archer Queen, Magic Archer, Royal Ghost, Arrows, Barbarians, Heal Spirit, Bandit;Duelo;4;0;900;Tower Princess;3
2026-06-11;Reset;TOP_GLOBAL;#YG0LVJ9;Rockyplanet02;900;2;#8UJ2UUJ8;#MuUuKaNs!!;2;0;4;0;Mega Knight, Archer Queen, Bats, Bandit, Wall Breakers, Prince, Zap, Arrows;RangeBattle;Firecracker, Knight, Tesla, The Log, Goblins, Hog Rider, Earthquake, Ice Spirit;RangeBattle;Giant Snowball, Goblin Drill, Furnace, Berserker, Poison, Cannon, Royal Delivery, Skeletons;Duelo;Royal Hogs, Barbarian Barrel, Goblin Cage, Fireball, Electro Spirit, Royal Recruits, Zappies, Flying Machine;Duelo;4;0;900;Tower Princess;3
2026-06-11;Reset;TOP_GLOBAL;#JPLU0LUCQ;MuK｜⚡maestro⚡;900;3;#8UJ2UUJ8;#MuUuKaNs!!;2;0;4;0;Goblin Barrel, Knight, Princess, The Log, Inferno Tower, Goblin Gang, Rocket, Fire Spirit;RangeBattle;Royal Giant, Barbarian Barrel, Royal Ghost, Goblins, Hunter, Lightning, Electro Spirit, Fisherman;RangeBattle;Cannon, Ice Golem, Musketeer, Hog Rider, Giant Snowball, Skeletons, Ice Spirit, Fireball;Duelo;Mega Knight, Archer Queen, Wall Breakers, Prince, Bats, Bandit, Arrows, Zap;Duelo;4;0;900;Tower Princess;3
2026-06-11;Reset;TOP_GLOBAL;#JJL0QGG9L;Bomboclat;900;1;#9U82JJ0Y;TheAddictedOnes;3;0;4;0;Witch, Bowler, Mini P.E.K.K.A, Graveyard, Giant, Zap, Minions, Arrows;RangeBattle;Royal Giant, Barbarian Barrel, Hunter, Royal Ghost, Fireball, Electro Spirit, Fisherman, Skeletons;RangeBattle;Firecracker, Mighty Miner, Cannon, Earthquake, Hog Rider, Ice Spirit, The Log, Goblins;Duelo;Goblin Drill, Knight, Giant Snowball, Poison, Bomber, Fire Spirit, Berserker, Tesla;Duelo;4;0;900;Tower Princess;3
2026-06-11;Reset;TOP_GLOBAL;#20R0U0JQ8;memo;900;2;#9U82JJ0Y;TheAddictedOnes;3;0;4;0;Archers, Monk, Tesla, Skeletons, The Log, Electro Spirit, X-Bow, Fireball;RangeBattle;Royal Hogs, Mini P.E.K.K.A, Royal Recruits, Dart Goblin, Arrows, Goblin Cage, Vines, Zappies;RangeBattle;Mega Knight, Musketeer, Bats, Earthquake, Royal Delivery, Giant Snowball, Cannon, Hog Rider;Duelo;Lumberjack, Balloon, Archer Queen, Freeze, Tombstone, Mega Minion, Baby Dragon, Poison;Duelo;4;0;900;Tower Princess;3
2026-06-11;Reset;TOP_GLOBAL;#Q09UJGPLR;Yoon_0117;900;3;#9U82JJ0Y;TheAddictedOnes;3;0;4;0;Bats, Skeleton King, Mortar, Arrows, Cannon Cart, Goblin Gang, Ice Wizard, Miner;RangeBattle;Executioner, Knight, Ice Spirit, Guards, Hog Rider, Lightning, The Log, Tornado;RangeBattle;Goblin Barrel, Goblins, Princess, Inferno Tower, Dart Goblin, Fire Spirit, Valkyrie, Wall Breakers;Duelo;Royal Ghost, Barbarian Barrel, Royal Giant, Electro Spirit, Fireball, Fisherman, Hunter, Skeletons;Duelo;4;0;900;Tower Princess;3
2026-06-11;Reset;TOP_GLOBAL;#9LUQP8VL;Hagan;900;4;#9U82JJ0Y;TheAddictedOnes;3;0;4;0;Ice Spirit, Ice Golem, Lumberjack, Arrows, Musketeer, Balloon, Minions, Royal Delivery;RangeBattle;P.E.K.K.A, Magic Archer, Battle Ram, Bandit, Poison, Zap, Electro Wizard, Royal Ghost;Duelo;Firecracker, Tesla, Valkyrie, Earthquake, The Log, Skeletons, Hog Rider, Fire Spirit;Duelo;Mega Knight, Mini P.E.K.K.A, Electro Dragon, Royal Giant, Fireball, Electro Spirit, Goblin Gang, Rage;RangeBattle;4;0;900;Tower Princess;3
2026-06-11;Reset;TOP_GLOBAL;#LQ20VGY;AM ⚡️ HAZ;900;5;#9U82JJ0Y;TheAddictedOnes;3;0;4;0;Witch, Mega Minion, Goblin Giant, Giant Skeleton, Zappies, Arrows, Goblin Gang, The Log;RangeBattle;Royal Giant, Wizard, Valkyrie, Goblins, Minions, Knight, Goblin Barrel, Zap;RangeBattle;Furnace, Mini P.E.K.K.A, Royal Recruits, Musketeer, Bats, Vines, Barbarian Barrel, Dark Prince;Duelo;Mega Knight, Magic Archer, Royal Ghost, Skeleton Barrel, Skeleton Dragons, Prince, Firecracker, Rage;Duelo;4;0;900;Tower Princess;3
2026-06-11;Reset;TOP_GLOBAL;#29YRRJR;Robin;900;1;#9LVQLR;Band of Adultes;5;0;4;0;Baby Dragon, Knight, Bowler, Barbarian Barrel, Tornado, Electro Giant, Lightning, Goblin Hut;RangeBattle;Battle Ram, Magic Archer, Golden Knight, Zap, P.E.K.K.A, Electro Wizard, Bandit, Poison;RangeBattle;Royal Hogs, Dark Prince, Lumberjack, Giant Skeleton, Arrows, Fisherman, Mother Witch, Zappies;Duelo;Mortar, Goblins, Skeleton Barrel, Musketeer, Cannon Cart, Minions, Fireball, The Log;Duelo;4;0;900;Tower Princess;3
