data_coleta;dia_batalha;conta_tipo;player_tag;player_nome;player_fame;player_posicao;clan_tag;clan_nome;clan_posicao;clan_fame;decks_usados;boat_attacks;deck_1;deck_1_tipo;deck_2;deck_2_tipo;deck_3;deck_3_tipo;deck_4;deck_4_tipo;war_vitorias;war_derrotas;war_medals;war_torre;war_battles_count
2026-06-26;Dia 1;#2QR292P;#2QR292P;ツ ︻デ═一⟿ΔЯ₡λↁΣ☯︎;100;1;#QCLPL9VQ;Tropa Do Bruxo;5;400;1;0;;;;;;;;;0;0;0;Tower Princess;0
2026-06-26;Dia 1;#2QR292P;#JGLQVVP9L;GDAlex18;500;4;#GR8UGRVJ;peru;3;1395;4;0;;;;;;;;;0;0;0;Tower Princess;0
2026-06-26;Dia 1;#2QR292P;#L8GYPCRUJ;Efiend;500;5;#GR8UGRVJ;peru;3;1395;4;0;;;;;;;;;0;0;0;Tower Princess;0
2026-06-26;Dia 1;#2QR292P;#20YQPLVUR2;FLI DUKE;600;3;#LLJPJ2JQ;28 royale 29;4;880;4;0;;;;;;;;;0;0;0;Tower Princess;0
2026-06-26;Dia 1;#2QR292P;#JJ92QL9Q2;Baldolino87;625;3;#GR8UGRVJ;peru;3;1395;4;1;Clone, Fireball, Mirror, Executioner, Magic Archer, Royal Recruits, Three Musketeers, Elite Barbarians;RangeBattle;Knight, Mega Knight, Electro Giant, Giant Skeleton, Skeleton Dragons, Sparky, Rascals, Rocket;RangeBattle;Firecracker, Boss Bandit, Archer Queen, Valkyrie, Goblin Gang, Goblin Giant, Minion Horde, Guards;Barco;P.E.K.K.A, Wizard, Princess, Bowler, Mini P.E.K.K.A, Witch, Dart Goblin, Balloon;RangeBattle;3;1;625;Tower Princess;4
2026-06-26;Dia 1;#2QR292P;#UP8LGP29P;coras;700;1;#GR8UGRVJ;peru;3;1395;4;0;;;;;;;;;0;0;0;Tower Princess;0
2026-06-26;Dia 1;#2QR292P;#VUP0UUQGY;lufe;700;2;#GR8UGRVJ;peru;3;1395;4;0;;;;;;;;;0;0;0;Tower Princess;0
2026-06-26;Dia 1;#2QR292P;#2J82JYVRV;CalonSoler;750;5;#YYG9V0VC;Orcos Samurai;2;1891;4;2;;;;;;;;;0;0;0;Tower Princess;0
2026-06-26;Dia 1;#2QR292P;#GJQYGV028;daniL;800;4;#99V9V22C;IRAN SOLID;1;3423;4;0;;;;;;;;;0;0;0;Tower Princess;0
2026-06-26;Dia 1;#2QR292P;#CL80Y2GLU;ghazaleh;800;5;#99V9V22C;IRAN SOLID;1;3423;4;0;;;;;;;;;0;0;0;Tower Princess;0
2026-06-26;Dia 1;#2QR292P;#CCRUUJ00;alexia;800;4;#YYG9V0VC;Orcos Samurai;2;1891;4;0;;;;;;;;;0;0;0;Tower Princess;0
2026-06-26;Dia 1;#2QR292P;#PV002QGYG;qmatinp;900;3;#99V9V22C;IRAN SOLID;1;3423;6;0;Wizard, Dark Prince, Tesla, Witch, Goblin Gang, Skeletons, Archers, Prince;RangeBattle;Knight, Golden Knight, Mini P.E.K.K.A, Valkyrie, Executioner, Zap, Musketeer, Lumberjack;RangeBattle;Bomber, P.E.K.K.A, Giant Snowball, Arrows, Goblins, Elite Barbarians, Royal Giant, Guards;RangeBattle;;;1;2;400;Tower Princess;3
2026-06-26;Dia 1;#2QR292P;#CQJYV08QJ;wosito;900;2;#LLJPJ2JQ;28 royale 29;4;880;4;0;;;;;;;;;0;0;0;Tower Princess;0
2026-06-26;Dia 1;#2QR292P;#2GLGURJCL;PTV_gravity;1050;3;#YYG9V0VC;Orcos Samurai;2;1891;8;0;Valkyrie, Baby Dragon, Hog Rider, Witch, Musketeer, Wizard, Electro Wizard, Minion Horde;Barco;Bomber, Knight, Firecracker, Balloon;Barco;Wizard, Firecracker, Mega Minion, Balloon, Flying Machine, Night Witch, Guards, Furnace;RangeBattle;Dart Goblin, Bomber, Royal Ghost, Minions, Prince, Skeleton Dragons, Ice Wizard, Fireball;RangeBattle;1;4;575;Tower Princess;4
2026-06-26;Dia 1;TOP_GLOBAL;#8J0P88YL;Djinn;1100;5;#P2P2Y880;! ShocK-13 !;5;2235;8;0;Baby Dragon, Mega Minion, Valkyrie, Lava Hound, Balloon, Fireball, Vines, Tombstone;RangeBattle;Goblin Giant, Dark Prince, Zap, Elite Barbarians, Sparky, Electro Wizard, Heal Spirit, Rage;RangeBattle;Goblin Cage, Barbarian Barrel, Royal Recruits, Flying Machine, Zappies, Arrows, Electro Spirit, Royal Hogs;Duelo;Dart Goblin, Skeleton Barrel, Mega Knight, Inferno Dragon, Goblin Gang, Spear Goblins, Bats, Giant Snowball;Duelo;1;3;500;Tower Princess;3
2026-06-26;Dia 1;#2QR292P;#8VC2VLUC2;vahid;1150;2;#99V9V22C;IRAN SOLID;1;3423;7;0;Mini P.E.K.K.A, Boss Bandit, Electro Giant, Hunter, Minions, Zap, Guards, Furnace;RangeBattle;P.E.K.K.A, Lumberjack, Dart Goblin, Arrows, Electro Wizard, Poison, Executioner, Rage;Duelo;Mega Knight, Wizard, Balloon, Minion Horde, Witch, Fireball, Freeze, Prince;Duelo;Valkyrie, Firecracker, Fire Spirit, Dark Prince, Elite Barbarians, Royal Recruits, Goblin Gang, Baby Dragon;Duelo;2;1;600;Tower Princess;2
2026-06-26;Dia 1;#2QR292P;#LC90JC98;cristian;1200;2;#YYG9V0VC;Orcos Samurai;2;1891;8;0;Firecracker, Little Prince, Electro Dragon, Mega Knight, Musketeer, Hog Rider, Zap, Ram Rider;RangeBattle;Archers, Executioner, Royal Giant, Witch, P.E.K.K.A, Valkyrie, Skeleton Army, Wall Breakers;RangeBattle;Golem, Arrows, Skeleton Barrel, Wizard, Magic Archer, Dart Goblin, Mini P.E.K.K.A, Poison;RangeBattle;Giant, Princess, Goblin Gang, Goblin Barrel, Bomber, Sparky, Inferno Dragon, Bats;RangeBattle;2;2;600;Tower Princess;4
2026-06-26;Dia 1;TOP_GLOBAL;#CRVC0088P;dood;1300;4;#P2P2Y880;! ShocK-13 !;5;2235;8;0;;;;;;;;;0;0;0;Tower Princess;0
2026-06-26;Dia 1;TOP_GLOBAL;#G0C8V02;GS I Aearon;1400;3;#P2P2Y880;! ShocK-13 !;5;2235;8;0;Inferno Dragon, Magic Archer, Balloon, Lava Hound, Zap, Skeleton Dragons, Guards, Arrows;RangeBattle;Royal Giant, Wizard, Monk, Valkyrie, Giant Snowball, Fisherman, Electro Spirit, The Log;RangeBattle;Furnace, Bowler, Baby Dragon, Minions, Vines, Golem, Goblin Machine, Mini P.E.K.K.A;Duelo;Firecracker, Mighty Miner, Goblins, Royal Recruits, Wall Breakers, Fireball, Goblin Gang, Skeleton Barrel;Duelo;1;3;500;Tower Princess;3
2026-06-26;Dia 1;#2QR292P;#JVGU0Q2Y9;Salvix;1400;1;#YYG9V0VC;Orcos Samurai;2;1891;8;0;Valkyrie, Mega Knight, Skeleton King, Executioner, Electro Wizard, Princess, Firecracker, Elixir Golem;RangeBattle;Dart Goblin, Wizard, Magic Archer, Inferno Tower, Goblin Barrel, Skeleton Dragons, Prince, Ram Rider;RangeBattle;Royal Hogs, Dark Prince, Skeleton Barrel, Royal Ghost, Tesla, Minion Horde, Arrows, Elite Barbarians;RangeBattle;Archers, P.E.K.K.A, Mini P.E.K.K.A, Fireball, Baby Dragon, Skeleton Army, Knight, Witch;RangeBattle;3;1;700;Tower Princess;4
2026-06-26;Dia 1;TOP_GLOBAL;#QJV9PC9P;⚡Mstyle57⚡;1450;5;#9LVQLR;Band of Adultes;4;3435;8;0;Zap, Graveyard, Furnace, Minions, Goblin Curse, Berserker, Goblin Hut, Giant Skeleton;RangeBattle;P.E.K.K.A, Magic Archer, Royal Ghost, Bandit, Electro Wizard, The Log, Poison, Battle Ram;Duelo;Electro Dragon, Dark Prince, Witch, Tornado, Elixir Golem, Vines, Battle Healer, Inferno Dragon;Duelo;Royal Recruits, Barbarian Barrel, Royal Hogs, Flying Machine, Zappies, Arrows, Goblin Cage, Fireball;Duelo;3;0;700;Tower Princess;2
2026-06-26;Dia 1;TOP_GLOBAL;#8C2LCCVP;Ve2 I ☢️markez☢;1500;5;#L9VRJ;Calalas España;1;3192;8;0;Electro Dragon, Monk, Inferno Dragon, Zap, Tornado, Battle Healer, Elixir Golem, Rage;RangeBattle;Royal Recruits, Wizard, Goblin Cage, Arrows, Zappies, Fireball, Royal Hogs, Electro Spirit;Duelo;Skeleton Barrel, Magic Archer, Barbarians, Clone, Earthquake, Flying Machine, Giant Skeleton, Skeleton Dragons;Duelo;Mega Knight, Archer Queen, Wall Breakers, Giant Snowball, Minions, Vines, Prince, Miner;Duelo;2;1;600;Tower Princess;2
2026-06-26;Dia 1;#2QR292P;#UYJ0YGYP;amir.cr7;1500;1;#99V9V22C;IRAN SOLID;1;3423;8;0;Mega Knight, Wizard, Valkyrie, Balloon, Tesla, Royal Delivery, Rage, Goblin Gang;RangeBattle;P.E.K.K.A, Zap, Executioner, Fireball, Hog Rider, Electro Wizard, Bandit, Royal Ghost;RangeBattle;Witch, Knight, Electro Dragon, Royal Giant, Bowler, The Log, Cannon, Goblin Barrel;Duelo;Firecracker, Musketeer, Dart Goblin, Mini P.E.K.K.A, Electro Giant, Cannon Cart, Wall Breakers, Minions;Duelo;3;1;800;Tower Princess;3
2026-06-26;Dia 1;TOP_GLOBAL;#2LV8RL09J;Festinho 7;1550;4;#L9VRJ;Calalas España;1;3192;8;0;Lumberjack, Bowler, Electro Dragon, Freeze, Inferno Dragon, Tornado, Barbarian Barrel, Balloon;RangeBattle;;;;;;;1;0;200;Tower Princess;1
2026-06-26;Dia 1;TOP_GLOBAL;#LQ20VGY;AM ⚡️ HAZ;1550;5;#9U82JJ0Y;TheAddictedOnes;3;3435;8;0;Witch, Mega Minion, Goblin Giant, Giant Skeleton, Zappies, Arrows, Goblin Gang, The Log;RangeBattle;Royal Giant, Wizard, Valkyrie, Goblins, Minions, Knight, Goblin Barrel, Zap;RangeBattle;Furnace, Mini P.E.K.K.A, Royal Recruits, Musketeer, Bats, Vines, Barbarian Barrel, Dark Prince;Duelo;Mega Knight, Magic Archer, Royal Ghost, Skeleton Barrel, Skeleton Dragons, Prince, Firecracker, Rage;Duelo;4;0;900;Tower Princess;3
2026-06-26;Dia 1;TOP_GLOBAL;#P8UQRJV99;toni137945;1550;4;#9LVQLR;Band of Adultes;4;3435;8;0;Lumberjack, Skeleton King, Witch, Phoenix, Vines, Mega Knight, Miner, Bats;RangeBattle;Royal Giant, Mega Minion, Bowler, Mother Witch, Ice Wizard, Prince, Barbarian Barrel, Dark Prince;RangeBattle;Valkyrie, Mini P.E.K.K.A, Electro Dragon, Elixir Golem, Rage, Inferno Dragon, Battle Healer, Arrows;Duelo;Royal Ghost, Magic Archer, P.E.K.K.A, Battle Ram, Fireball, Zap, Bandit, Electro Wizard;Duelo;4;0;900;Tower Princess;3
2026-06-26;Dia 1;TOP_GLOBAL;#8G2CJG9L;pяiисе;1600;3;#L9VRJ;Calalas España;1;3192;8;0;;;;;;;;;0;0;0;Tower Princess;0
2026-06-26;Dia 1;TOP_GLOBAL;#9QUVUL2LL;Captain Levi;1600;2;#9U82JJ0Y;TheAddictedOnes;3;3435;8;0;Inferno Dragon, Musketeer, Mega Knight, Knight, Poison, Hog Rider, Vines, Tesla;RangeBattle;Barbarians, Phoenix, Electro Dragon, Elixir Golem, Battle Healer, Tornado, Rage, Void;Duelo;Battle Ram, P.E.K.K.A, Wizard, Bandit, Zap, Electro Wizard, Goblin Hut, Fireball;Duelo;Witch, Mega Minion, Lumberjack, Arrows, Cannon, Golem, Mini P.E.K.K.A, Lightning;Duelo;3;0;700;Tower Princess;2
2026-06-26;Dia 1;TOP_GLOBAL;#UGJV8JC;Stnwl Jksn;1600;3;#9U82JJ0Y;TheAddictedOnes;3;3435;8;0;Inferno Dragon, Balloon, Barbarians, Bomber, Arrows, Giant Snowball, Lava Hound, Void;RangeBattle;Lumberjack, Barbarian Barrel, Electro Dragon, Golem, Elixir Collector, Skeleton Dragons, Tornado, Battle Healer;RangeBattle;Battle Ram, Magic Archer, P.E.K.K.A, Royal Ghost, Poison, Electro Wizard, Bandit, Zap;Duelo;Goblin Cage, Golden Knight, Royal Recruits, Royal Hogs, Flying Machine, Fireball, Zappies, Electro Spirit;Duelo;4;0;900;Tower Princess;3
2026-06-26;Dia 1;TOP_GLOBAL;#8UV9CPL2V;Torre the Great;1600;4;#9U82JJ0Y;TheAddictedOnes;3;3435;8;0;Firecracker, Golden Knight, Furnace, Royal Hogs, Fireball, Cannon, Royal Recruits, Arrows;RangeBattle;Skeleton Barrel, Goblins, Royal Ghost, Suspicious Bush, Rocket, Dart Goblin, Rascals, The Log;RangeBattle;Lumberjack, Mega Minion, Goblin Cage, Poison, Baby Dragon, Flying Machine, Barbarian Barrel, Battle Ram;Duelo;Inferno Dragon, Magic Archer, Witch, Battle Healer, Lightning, Golem, Bomb Tower, Vines;Duelo;3;1;800;Tower Princess;3
2026-06-26;Dia 1;TOP_GLOBAL;#8P2V9LJP;ROZE;1600;3;#9LVQLR;Band of Adultes;4;3435;8;0;Skeleton Barrel, Barbarian Barrel, Mortar, Cannon Cart, Berserker, Fireball, Goblin Gang, Ice Wizard;RangeBattle;Firecracker, Knight, Tesla, Hog Rider, Earthquake, Skeletons, Royal Delivery, The Log;RangeBattle;Battle Ram, Bowler, Lumberjack, Giant Skeleton, Mother Witch, Fisherman, Zappies, Arrows;Duelo;Goblin Barrel, Goblins, Valkyrie, Wall Breakers, Princess, Dart Goblin, Ice Spirit, Cannon;Duelo;3;1;800;Tower Princess;3
2026-06-26;Dia 1;TOP_GLOBAL;#Q0CRVCQR9;2093 Arley;1600;2;#P2P2Y880;! ShocK-13 !;5;2235;8;0;Tesla, Barbarian Barrel, Dart Goblin, Goblin Barrel, Knight, Goblin Gang, Skeleton Army, Rascals;RangeBattle;P.E.K.K.A, Golden Knight, Firecracker, Fireball, Zap, Minions, Battle Ram, Royal Ghost;RangeBattle;Cannon, Dark Prince, Skeletons, Rocket, Royal Delivery, The Log, Miner, Electro Spirit;Duelo;Electro Dragon, Balloon, Lumberjack, Tornado, Freeze, Valkyrie, Goblin Cage, Ice Wizard;Duelo;4;0;900;Tower Princess;3
2026-06-26;Dia 1;TOP_GLOBAL;#299URU2G0;Diakloz;1700;2;#L9VRJ;Calalas España;1;3192;8;0;Royal Giant, Monk, Hunter, Skeletons, Fisherman, Electro Spirit, Lightning, Rage;RangeBattle;Royal Hogs, Magic Archer, Royal Ghost, Goblin Hut, The Log, Fireball, Berserker, Ice Spirit;Duelo;Giant Snowball, Goblins, Tesla, Poison, Goblin Drill, Bomber, Fire Spirit, Knight;Duelo;Mortar, Barbarian Barrel, Skeleton Barrel, Cannon Cart, Arrows, Minions, Rascals, Guards;Duelo;3;0;700;Tower Princess;2
2026-06-26;Dia 1;TOP_GLOBAL;#2Q8LLC2;KOOPMEINERS;1700;4;#8UJ2UUJ8;#MuUuKaNs!!;2;3435;8;0;Goblin Barrel, Cannon, Valkyrie, Dart Goblin, Goblin Gang, Princess, Wall Breakers, Ice Spirit;RangeBattle;Tesla, Mighty Miner, Firecracker, Electro Spirit, The Log, Earthquake, Skeletons, Hog Rider;RangeBattle;Royal Recruits, Barbarian Barrel, Goblin Cage, Arrows, Flying Machine, Royal Hogs, Fireball, Zappies;Duelo;Executioner, Golden Knight, Inferno Dragon, Graveyard, Tornado, Bowler, Freeze, Guards;Duelo;3;1;800;Tower Princess;3
2026-06-26;Dia 1;TOP_GLOBAL;#8999GPJ8Y;Costa;1700;5;#8UJ2UUJ8;#MuUuKaNs!!;2;3435;8;0;Battle Ram, Wizard, Lumberjack, Giant Skeleton, Fireball, Barbarian Barrel, Mother Witch, Zappies;RangeBattle;Valkyrie, Goblins, Executioner, Ice Spirit, Lightning, Cannon, Hog Rider, The Log;Duelo;Goblin Giant, Mini P.E.K.K.A, Zap, Dark Prince, Electro Wizard, Minions, Sparky, Rage;Duelo;Electro Dragon, Bowler, Knight, Inferno Dragon, Freeze, Tornado, Balloon, Bomber;Duelo;3;0;700;Tower Princess;2
2026-06-26;Dia 1;TOP_GLOBAL;#88Q2YJ2Y;caveman13;1700;1;#9U82JJ0Y;TheAddictedOnes;3;3435;8;0;Witch, Giant, Giant Snowball, Minions, Arrows, Mini P.E.K.K.A, Bowler, Graveyard;RangeBattle;Skeleton Barrel, Musketeer, Mortar, Knight, Fireball, Goblin Gang, The Log, Spear Goblins;RangeBattle;Royal Giant, Barbarian Barrel, Goblin Cage, Skeleton Dragons, Firecracker, Skeletons, Electro Spirit, Lightning;Duelo;Battle Ram, Magic Archer, Royal Ghost, P.E.K.K.A, Electro Wizard, Bandit, Zap, Poison;Duelo;4;0;900;Tower Princess;3
2026-06-26;Dia 1;TOP_GLOBAL;#902R98QQ;el roz;1700;1;#9LVQLR;Band of Adultes;4;3435;8;0;Royal Hogs, Archer Queen, Giant Snowball, Arrows, Cannon, Royal Delivery, Fire Spirit, Goblins;RangeBattle;Archers, Mini P.E.K.K.A, Knight, Goblin Giant, Fireball, Rage, Minions, Sparky;RangeBattle;Ice Spirit, Hog Rider, Witch, Goblin Hut, Skeletons, Berserker, Earthquake, The Log;Duelo;Mega Knight, Zap, Bats, Miner, Inferno Dragon, Goblin Gang, Spear Goblins, Skeleton Barrel;Duelo;4;0;900;Tower Princess;3
2026-06-26;Dia 1;TOP_GLOBAL;#R9QQ00PR;Guillermiento;1700;2;#9LVQLR;Band of Adultes;4;3435;8;0;Goblin Cage, Golden Knight, Inferno Dragon, Bowler, Arrows, Zappies, Freeze, Graveyard;RangeBattle;Valkyrie, Archer Queen, Bats, Mortar, Skeletons, Electro Spirit, Miner, Fireball;RangeBattle;Skeleton Barrel, Skeleton King, Skeleton Army, Dart Goblin, Fire Spirit, Suspicious Bush, Vines, Mother Witch;Duelo;Mega Knight, Little Prince, Royal Ghost, Goblins, Furnace, Giant Snowball, Ram Rider, Lightning;Duelo;3;1;800;Tower Princess;3
2026-06-26;Dia 1;#2QR292P;#JGQ0YQ0J;KickboxinG;1700;1;#LLJPJ2JQ;28 royale 29;4;880;8;0;Royal Hogs, Hog Rider, Furnace, Flying Machine, Mega Knight, Ice Spirit, Bats, Spear Goblins;RangeBattle;Valkyrie, Wizard, Inferno Dragon, Golem, Skeleton Barrel, Heal Spirit, Tornado, Wall Breakers;RangeBattle;Baby Dragon, Skeleton King, Goblin Giant, Poison, Prince, Firecracker, Mortar, Mini P.E.K.K.A;Duelo;Knight, Mega Minion, Bomber, Fireball, Bandit, Giant Skeleton, Night Witch, The Log;Duelo;3;1;800;Tower Princess;3
2026-06-26;Dia 1;TOP_GLOBAL;#U9R0LLVUY;messi G.O.A.T;1800;1;#L9VRJ;Calalas España;1;3192;8;0;Mega Knight, Golden Knight, Battle Ram, Royal Ghost, Electro Wizard, Minions, Fireball, Zap;RangeBattle;Goblin Barrel, Goblinstein, Dart Goblin, Princess, Goblin Gang, Cannon, Wall Breakers, Ice Spirit;RangeBattle;Royal Giant, Barbarian Barrel, Goblin Cage, Lumberjack, Phoenix, Skeletons, Electro Spirit, Lightning;Duelo;Musketeer, Tombstone, Valkyrie, Baby Dragon, Guards, The Log, Poison, Graveyard;Duelo;4;0;900;Tower Princess;3
2026-06-26;Dia 1;TOP_GLOBAL;#228C80JCL;MuK｜⚡️Mari 冰姬⚡️;1800;1;#8UJ2UUJ8;#MuUuKaNs!!;2;3435;8;0;Mega Knight, Archer Queen, Wall Breakers, Prince, Arrows, Goblin Gang, Bandit, Bats;RangeBattle;Goblin Giant, Mini P.E.K.K.A, Zap, Sparky, Mother Witch, Minions, Dark Prince, Rage;Duelo;Royal Giant, Barbarian Barrel, Royal Ghost, Hunter, Fireball, Electro Spirit, Skeletons, Fisherman;Duelo;Furnace, Mighty Miner, Goblins, The Log, Lightning, Ice Spirit, Hog Rider, Cannon;RangeBattle;4;0;900;Tower Princess;3
2026-06-26;Dia 1;TOP_GLOBAL;#G90GVY8V0;MuK｜⚡Waluigi⚡;1800;2;#8UJ2UUJ8;#MuUuKaNs!!;2;3435;8;0;Goblin Giant, Mini P.E.K.K.A, Zap, Dark Prince, Electro Wizard, Minions, Sparky, Rage;RangeBattle;Valkyrie, Goblins, Firecracker, Earthquake, Tesla, The Log, Hog Rider, Ice Spirit;RangeBattle;Mortar, Skeleton King, Bats, Goblin Gang, Miner, Ice Wizard, Cannon Cart, Arrows;Duelo;Executioner, Golden Knight, Inferno Dragon, Tornado, Graveyard, Freeze, Bowler, Guards;Duelo;4;0;900;Tower Princess;3
2026-06-26;Dia 1;TOP_GLOBAL;#GRLGRUR9;Falcy;1800;3;#8UJ2UUJ8;#MuUuKaNs!!;2;3435;8;0;Zap, Giant, Bomber, Fireball, Mega Minion, Mini P.E.K.K.A, Rage, Dark Prince;RangeBattle;Wall Breakers, Archer Queen, Mega Knight, Prince, Bandit, Goblin Gang, Arrows, Bats;RangeBattle;;;;;2;0;400;Tower Princess;2
2026-06-26;Dia 1;TOP_GLOBAL;#QU8P09YR;Lukas ❤️ Drill;1800;1;#P2P2Y880;! ShocK-13 !;5;2235;8;0;Furnace, Mighty Miner, Cannon, Hog Rider, Skeletons, Ice Spirit, The Log, Lightning;RangeBattle;Royal Giant, Barbarian Barrel, Royal Ghost, Electro Spirit, Fireball, Guards, Fisherman, Hunter;RangeBattle;Mortar, Goblins, Skeleton Barrel, Arrows, Skeleton Dragons, Rascals, Minions, Cannon Cart;Duelo;Goblin Drill, Knight, Giant Snowball, Fire Spirit, Berserker, Poison, Tesla, Bomber;Duelo;4;0;900;Tower Princess;3
