data_coleta;dia_batalha;conta_tipo;player_tag;player_nome;player_fame;player_posicao;clan_tag;clan_nome;clan_posicao;clan_fame;decks_usados;boat_attacks;deck_1;deck_1_tipo;deck_2;deck_2_tipo;deck_3;deck_3_tipo;deck_4;deck_4_tipo;war_vitorias;war_derrotas;war_medals;war_torre;war_battles_count
2026-07-23;Reset;TOP_GLOBAL;#80PPP0LU;BoA THIBAUD;0;4;#9LVQLR;Band of Adultes;4;0;0;0;;;;;;;;;0;0;0;Tower Princess;0
2026-07-23;Reset;TOP_GLOBAL;#8P2V9LJP;ROZE;0;5;#9LVQLR;Band of Adultes;4;0;0;0;;;;;;;;;0;0;0;Tower Princess;0
2026-07-23;Reset;#2QR292P;#GGV0U2UPQ;cratos;75;39;#QCLPL9VQ;Tropa Do Bruxo;1;0;0;0;Royal Hogs, Mega Knight, Valkyrie, Witch, Wizard, Elixir Golem, Bowler, Dark Prince;Barco;Executioner, Elite Barbarians, Balloon, Hog Rider;Barco;;;;;0;1;75;Tower Princess;1
2026-07-23;Reset;#2QR292P;#RPQY8YP90;حضرت موسی (ع);300;2;#R0JUGVR9;TITA;4;0;2;0;Inferno Dragon, Wizard, Mega Knight, Sparky, Mirror, Princess, Lumberjack, Rocket;RangeBattle;Tesla, Electro Dragon, Musketeer, Valkyrie, X-Bow, Elite Barbarians, Mini P.E.K.K.A, Fireball;RangeBattle;;;;;1;1;300;Tower Princess;2
2026-07-23;Reset;TOP_GLOBAL;#8J0P88YL;Djinn;400;4;#P2P2Y880;! ShocK-13 !;5;0;4;0;Baby Dragon, Mega Minion, Valkyrie, Lava Hound, Balloon, Fireball, Vines, Tombstone;RangeBattle;Dart Goblin, Skeleton Barrel, Mega Knight, Inferno Dragon, Goblin Gang, Spear Goblins, Bats, Giant Snowball;RangeBattle;Goblin Giant, Dark Prince, Zap, Elite Barbarians, Sparky, Electro Wizard, Heal Spirit, Rage;RangeBattle;Goblin Cage, Barbarian Barrel, Royal Recruits, Flying Machine, Zappies, Arrows, Electro Spirit, Royal Hogs;RangeBattle;0;4;400;Tower Princess;4
2026-07-23;Reset;TOP_GLOBAL;#222LCJP9R;神兵｜1nstinct;400;5;#P2P2Y880;! ShocK-13 !;5;0;4;0;Skeleton Barrel, Skeleton King, Mortar, Cannon Cart, Rascals, Dart Goblin, Minions, Arrows;RangeBattle;Royal Giant, Hunter, Royal Ghost, Fisherman, Skeletons, Electro Spirit, Lightning, The Log;RangeBattle;Baby Dragon, Barbarian Barrel, Electro Dragon, Golem, Battle Healer, Mini P.E.K.K.A, Elixir Collector, Tornado;Duelo;Valkyrie, Balloon, Zap, Lava Hound, Spirit Empress, Skeleton Dragons, Tombstone, Fireball;Duelo;0;4;400;Tower Princess;3
2026-07-23;Reset;#2QR292P;#PPPLJ2PJ;KIRA;400;1;#9C9UVJR8;Donations 2.0;2;0;4;4;;;;;;;;;0;0;0;Tower Princess;0
2026-07-23;Reset;#2QR292P;#YGGRCRV0V;Radman AS;400;1;#R0JUGVR9;TITA;4;0;2;0;Witch, Mini P.E.K.K.A, Wizard, Firecracker, Hog Rider, Goblin Gang, Magic Archer, Ice Spirit;RangeBattle;Valkyrie, Knight, Tesla, The Log, Bats, Ice Wizard, Electro Giant, Baby Dragon;RangeBattle;;;;;2;0;400;Tower Princess;2
2026-07-23;Reset;#2QR292P;#2R2JCYJV8;anton;500;2;#2Q2JGURL;www.geppetto.sk;3;0;4;0;Valkyrie, Witch, Mini P.E.K.K.A, Electro Wizard, Arrows, Goblin Gang, Goblin Barrel, Prince;RangeBattle;P.E.K.K.A, Goblins, Baby Dragon, Giant Snowball, The Log, Tornado, Skeleton Barrel, Executioner;RangeBattle;Knight, Furnace, Wizard, Mirror, Royal Ghost, Hog Rider, Lumberjack, Guards;Duelo;Mega Knight, Bats, Musketeer, Dart Goblin, Zap, Skeleton Army, Miner, Minions;Duelo;1;3;500;Tower Princess;3
2026-07-23;Reset;#2QR292P;#2UJ9YJQY;Lestat1984;525;1;#GQC8L2CG;TESCHIO NERO;5;0;4;1;Mega Knight, Golden Knight, Executioner, Musketeer, Giant Snowball, Barbarians, Goblin Barrel, Skeleton Army;RangeBattle;Witch, Royal Ghost, Royal Hogs, Mini P.E.K.K.A, Arrows, Princess, P.E.K.K.A, Minions;RangeBattle;Valkyrie, Wizard, Firecracker, Hog Rider, Zap, Elite Barbarians, Baby Dragon, Guards;RangeBattle;Electro Giant, Freeze, Giant, Royal Giant, Inferno Dragon, Sparky, Goblin Giant, Minion Horde;Barco;2;2;525;Tower Princess;4
2026-07-23;Reset;TOP_GLOBAL;#VLYVCC8QG;mHajeer722;550;3;#P2P2Y880;! ShocK-13 !;5;0;4;0;Royal Giant, Tesla, Dart Goblin, Skeleton Army, Bats, Prince, Bowler, Fireball;RangeBattle;Firecracker, Little Prince, Witch, Dark Prince, Goblin Barrel, Zap, Electro Giant, Valkyrie;Duelo;Wizard, Knight, Executioner, Mini P.E.K.K.A, Goblin Gang, Arrows, Giant Skeleton, Hog Rider;Duelo;Mega Knight, Boss Bandit, Skeletons, Magic Archer, Archers, The Log, Electro Wizard, Goblins;Duelo;0;3;300;Tower Princess;2
2026-07-23;Reset;TOP_GLOBAL;#2LRLL82;fede;650;5;#L9VRJ;Calalas España;1;0;4;0;Electro Dragon, Monk, Inferno Dragon, Elixir Golem, Zap, Battle Healer, Tornado, Rage;RangeBattle;Royal Recruits, Wizard, Goblin Cage, Electro Spirit, Fireball, Arrows, Royal Hogs, Zappies;Duelo;Skeleton Barrel, Magic Archer, Barbarians, Flying Machine, Clone, Giant Skeleton, Earthquake, Skeleton Dragons;Duelo;Mega Knight, Archer Queen, Giant Snowball, Wall Breakers, Prince, Miner, Vines, Minions;Duelo;3;0;700;Tower Princess;2
2026-07-23;Reset;TOP_GLOBAL;#2LCY8JYVC;Yakup12;700;2;#P2P2Y880;! ShocK-13 !;5;0;4;0;Witch, Ronin, Golden Knight, Knight, Flying Machine, Cannon, Elixir Golem, Battle Healer;RangeBattle;Tesla, Goblin Barrel, Dart Goblin, Zap, Elite Barbarians, Mini P.E.K.K.A, Fireball, Musketeer;RangeBattle;Lumberjack, Bowler, Mega Minion, Baby Dragon, Golem, Princess, Inferno Tower, Night Witch;Duelo;Mega Knight, Valkyrie, Hunter, Lightning, Balloon, Arrows, Firecracker, Tombstone;Duelo;2;2;700;Tower Princess;3
2026-07-23;Reset;#2QR292P;#YG9VCC998;Marcooo!11;700;1;#2Q2JGURL;www.geppetto.sk;3;0;4;0;Giant Snowball, Valkyrie, Witch, Rocket, Poison, Minion Horde, Tornado, Elite Barbarians;RangeBattle;Lumberjack, Princess, Hunter, Elixir Golem, Inferno Tower, Mother Witch, Guards, Fireball;RangeBattle;P.E.K.K.A, Musketeer, Dart Goblin, Goblin Gang, Skeleton Army, Arrows, Goblin Barrel, Giant Skeleton;RangeBattle;Mega Knight, Wizard, Firecracker, Zap, Goblins, Hog Rider, Knight, Sparky;RangeBattle;3;1;700;Tower Princess;4
2026-07-23;Reset;TOP_GLOBAL;#909GRUVJ;NL NSW PT報導;800;4;#L9VRJ;Calalas España;1;0;4;0;Royal Hogs, Golden Knight, Goblin Cage, Zappies, Flying Machine, Arrows, Royal Recruits, Fireball;RangeBattle;Furnace, Giant, Wizard, Mini P.E.K.K.A, Graveyard, Giant Snowball, Minions, Bowler;RangeBattle;Mortar, Goblins, Skeleton Barrel, Rascals, Cannon Cart, Rocket, Electro Spirit, Dart Goblin;Duelo;Witch, Dark Prince, Electro Dragon, Night Witch, Skeleton Dragons, Golem, Elixir Collector, Tornado;Duelo;3;1;800;Tower Princess;3
2026-07-23;Reset;TOP_GLOBAL;#CJ9G8PPPY;MuK｜⚡MiniAlex™⚡;800;4;#8UJ2UUJ8;#MuUuKaNs!!;2;0;4;0;Valkyrie, Goblins, Executioner, Ice Spirit, Hog Rider, Rocket, Tornado, The Log;RangeBattle;Mega Knight, Archer Queen, Bats, Wall Breakers, Prince, Bandit, Goblin Gang, Arrows;Duelo;Goblin Giant, Mini P.E.K.K.A, Zap, Rage, Minions, Mother Witch, Sparky, Dark Prince;Duelo;Royal Giant, Wizard, Royal Ghost, Skeletons, Fireball, Fisherman, Barbarian Barrel, Electro Spirit;RangeBattle;3;1;800;Tower Princess;3
2026-07-23;Reset;TOP_GLOBAL;#8GYJQ9VQ;MuK｜⚡Gioespo⚡️;800;5;#8UJ2UUJ8;#MuUuKaNs!!;2;0;4;0;Giant Snowball, Knight, Tesla, Goblin Demolisher, Poison, Fire Spirit, Goblin Drill, Goblins;RangeBattle;Royal Hogs, Wizard, Royal Ghost, Goblin Hut, The Log, Guards, Lightning, Electro Spirit;RangeBattle;Mega Knight, Archer Queen, Wall Breakers, Bandit, Zap, Prince, Goblin Gang, Arrows;Duelo;Mortar, Barbarian Barrel, Skeleton Barrel, Rascals, Minions, Fireball, Cannon Cart, Skeletons;Duelo;3;1;800;Tower Princess;3
2026-07-23;Reset;TOP_GLOBAL;#288VL09GC;Haqqi;800;3;#9U82JJ0Y;TheAddictedOnes;3;0;4;0;Battle Ram, P.E.K.K.A, Little Prince, Mother Witch, Royal Ghost, Bandit, Giant Snowball, Zap;RangeBattle;Valkyrie, Wizard, Ice Spirit, Cannon, The Log, Skeletons, Hog Rider, Earthquake;RangeBattle;Royal Recruits, Goblins, Mighty Miner, Firecracker, Goblin Gang, Wall Breakers, Skeleton Barrel, Arrows;Duelo;Baby Dragon, Knight, Archers, Poison, Graveyard, Tornado, Barbarian Barrel, Tombstone;Duelo;3;1;800;Tower Princess;3
2026-07-23;Reset;TOP_GLOBAL;#LQ20VGY;AM ⚡️ HAZ;800;4;#9U82JJ0Y;TheAddictedOnes;3;0;4;0;Witch, Mega Minion, Goblin Giant, Giant Skeleton, Zappies, Arrows, Goblin Gang, The Log;RangeBattle;Furnace, Mini P.E.K.K.A, Royal Recruits, Musketeer, Bats, Vines, Barbarian Barrel, Dark Prince;Duelo;Mega Knight, Magic Archer, Royal Ghost, Skeleton Barrel, Skeleton Dragons, Prince, Firecracker, Rage;Duelo;Royal Giant, Wizard, Valkyrie, Goblins, Minions, Knight, Goblin Barrel, Zap;Duelo;3;0;700;Tower Princess;2
2026-07-23;Reset;TOP_GLOBAL;#8UV9CPL2V;Torre the Great;800;5;#9U82JJ0Y;TheAddictedOnes;3;0;4;0;Executioner, Golden Knight, Electro Dragon, Graveyard, Guards, Tornado, Freeze, Bowler;RangeBattle;Inferno Dragon, Magic Archer, Witch, Battle Healer, Lightning, Golem, Cannon, Vines;RangeBattle;Lumberjack, Mega Minion, Goblin Cage, Poison, Baby Dragon, Flying Machine, Barbarian Barrel, Battle Ram;Duelo;Skeleton Barrel, Goblins, Royal Ghost, Suspicious Bush, Rocket, Dart Goblin, Rascals, The Log;Duelo;3;1;800;Tower Princess;3
2026-07-23;Reset;TOP_GLOBAL;#Q89UV8VU;Dodox;800;2;#9LVQLR;Band of Adultes;4;0;4;0;Furnace, Golden Knight, Mortar, Berserker, Graveyard, Giant Skeleton, Arrows, Poison;RangeBattle;Electro Dragon, Golem, Inferno Dragon, Lumberjack, Battle Healer, Barbarians, Tornado, Elixir Collector;Duelo;Bats, Skeleton King, Skeletons, Elixir Golem, Lightning, Night Witch, Phoenix, The Log;Duelo;Goblin Cage, Barbarian Barrel, Royal Hogs, Royal Recruits, Fireball, Zappies, Cannon Cart, Flying Machine;Duelo;3;0;700;Tower Princess;2
2026-07-23;Reset;TOP_GLOBAL;#8PCP0YVLP;AelWorld;800;3;#9LVQLR;Band of Adultes;4;0;4;0;Valkyrie, Mega Minion, Zap, Skeleton Dragons, Tombstone, Lava Hound, Berserker, Fireball;RangeBattle;Firecracker, Mighty Miner, Cannon, Electro Spirit, Earthquake, Skeletons, Hog Rider, The Log;RangeBattle;Skeleton Barrel, Goblins, Mega Knight, Arrows, Dart Goblin, Bats, Giant Snowball, Prince;Duelo;Goblin Barrel, Magic Archer, Wall Breakers, Fire Spirit, Ice Spirit, Rascals, Bomb Tower, Royal Delivery;Duelo;3;1;800;Tower Princess;3
2026-07-23;Reset;TOP_GLOBAL;#YCUR9VCU;Lioon❤️PEEP;800;1;#P2P2Y880;! ShocK-13 !;5;0;4;0;Baby Dragon, Knight, Goblin Cage, Graveyard, Poison, Guards, Barbarian Barrel, Ice Wizard;RangeBattle;Royal Ghost, Boss Bandit, Battle Ram, Minions, Electro Wizard, P.E.K.K.A, Rage, Goblin Curse;RangeBattle;;;;;1;1;300;Tower Princess;2
2026-07-23;Reset;TOP_GLOBAL;#8C2LCCVP;Ve2 I ☢️markez☢;900;1;#L9VRJ;Calalas España;1;0;4;0;Electro Dragon, Monk, Inferno Dragon, Zap, Tornado, Battle Healer, Elixir Golem, Rage;RangeBattle;Mega Knight, Archer Queen, Wall Breakers, Giant Snowball, Minions, Vines, Prince, Miner;RangeBattle;Royal Recruits, Wizard, Goblin Cage, Arrows, Zappies, Fireball, Royal Hogs, Electro Spirit;Duelo;Skeleton Barrel, Magic Archer, Barbarians, Clone, Earthquake, Flying Machine, Giant Skeleton, Skeleton Dragons;Duelo;4;0;900;Tower Princess;3
2026-07-23;Reset;TOP_GLOBAL;#LU0QVLUL;Grilletto;900;2;#L9VRJ;Calalas España;1;0;4;0;Royal Recruits, Barbarian Barrel, Goblin Cage, Royal Hogs, Flying Machine, Fireball, Zappies, Electro Spirit;RangeBattle;Bomber, Golem, Electro Dragon, Heal Spirit, Elite Barbarians, Baby Dragon, Lumberjack, Tornado;RangeBattle;Goblin Giant, Mini P.E.K.K.A, Zap, Electro Wizard, Rage, Sparky, Dark Prince, Phoenix;Duelo;Barbarians, Skeleton Dragons, Skeleton Barrel, Cannon Cart, Giant Skeleton, Arrows, Mother Witch, Clone;Duelo;4;0;900;Tower Princess;3
2026-07-23;Reset;TOP_GLOBAL;#2LV8RL09J;Festinho 7;900;3;#L9VRJ;Calalas España;1;0;4;0;Lumberjack, Bowler, Electro Dragon, Freeze, Inferno Dragon, Tornado, Barbarian Barrel, Balloon;RangeBattle;Royal Ghost, Magic Archer, P.E.K.K.A, Electro Wizard, Poison, Giant Snowball, Ram Rider, Dark Prince;RangeBattle;Skeleton Army, Fire Spirit, Zap, Inferno Tower, Prince, Elite Barbarians, Hog Rider, The Log;Duelo;Royal Recruits, Royal Hogs, Goblin Cage, Flying Machine, Zappies, Fireball, Electro Spirit, Arrows;Duelo;4;0;900;Tower Princess;3
2026-07-23;Reset;TOP_GLOBAL;#9YLQRJC;MuK｜⚡Re Fymo⚡;900;1;#8UJ2UUJ8;#MuUuKaNs!!;2;0;4;0;Goblin Giant, Mini P.E.K.K.A, Zap, Minions, Mother Witch, Sparky, Dark Prince, Rage;RangeBattle;Royal Giant, Barbarian Barrel, Royal Ghost, Hunter, Fisherman, Electro Spirit, Skeletons, Fireball;RangeBattle;Furnace, Mighty Miner, Goblins, Cannon, Ice Spirit, Hog Rider, The Log, Lightning;Duelo;Mega Knight, Archer Queen, Wall Breakers, Bandit, Bats, Goblin Gang, Arrows, Prince;Duelo;4;0;900;Tower Princess;3
2026-07-23;Reset;TOP_GLOBAL;#QLR0VRC;DarK｜⚡Lil Fymo⚡;900;2;#8UJ2UUJ8;#MuUuKaNs!!;2;0;4;0;Mega Knight, Archer Queen, Wall Breakers, Bandit, Arrows, Bats, Goblin Gang, Prince;RangeBattle;Furnace, Mighty Miner, Goblins, The Log, Cannon, Hog Rider, Ice Spirit, Lightning;RangeBattle;Royal Giant, Barbarian Barrel, Royal Ghost, Hunter, Skeletons, Fireball, Electro Spirit, Fisherman;Duelo;Goblin Giant, Mini P.E.K.K.A, Zap, Mother Witch, Dark Prince, Rage, Minions, Sparky;Duelo;4;0;900;Tower Princess;3
2026-07-23;Reset;TOP_GLOBAL;#R89JRQ09;MuK｜⚡ReaperⓇ⚡;900;3;#8UJ2UUJ8;#MuUuKaNs!!;2;0;4;0;Royal Giant, Barbarian Barrel, Royal Ghost, Goblins, Hunter, Fireball, Fisherman, Electro Spirit;RangeBattle;Wall Breakers, Archer Queen, Mega Knight, Prince, Bandit, Goblin Gang, Arrows, Zap;RangeBattle;Firecracker, Mighty Miner, Tesla, The Log, Skeletons, Hog Rider, Earthquake, Ice Spirit;Duelo;Goblin Drill, Knight, Giant Snowball, Cannon, Goblin Demolisher, Poison, Guards, Fire Spirit;Duelo;4;0;900;Tower Princess;3
2026-07-23;Reset;TOP_GLOBAL;#UGJV8JC;Stnwl Jksn;900;1;#9U82JJ0Y;TheAddictedOnes;3;0;4;0;Lumberjack, Barbarian Barrel, Electro Dragon, Golem, Elixir Collector, Skeleton Dragons, Tornado, Ronin;RangeBattle;Goblin Cage, Golden Knight, Royal Recruits, Royal Hogs, Flying Machine, Fireball, Zappies, Electro Spirit;RangeBattle;Battle Ram, Magic Archer, P.E.K.K.A, Royal Ghost, Poison, Electro Wizard, Bandit, Zap;Duelo;Inferno Dragon, Balloon, Barbarians, Bomber, Arrows, Miner, Lava Hound, Void;Duelo;4;0;900;Tower Princess;3
2026-07-23;Reset;TOP_GLOBAL;#LUUY9LJP;Diablo;900;2;#9U82JJ0Y;TheAddictedOnes;3;0;4;0;Skeleton Barrel, Bowler, Royal Ghost, Miner, Zap, Rascals, Electro Wizard, Poison;RangeBattle;Electro Dragon, Goblinstein, Mega Knight, The Log, Guards, Battle Healer, Tornado, Hog Rider;Duelo;Royal Recruits, Balloon, Lumberjack, Arrows, Goblin Hut, Zappies, Goblin Gang, Fireball;Duelo;Mortar, Knight, Skeleton Army, Giant Snowball, Ronin, Dart Goblin, Spear Goblins, Lightning;RangeBattle;4;0;900;Tower Princess;3
2026-07-23;Reset;TOP_GLOBAL;#GQ9LQRGCP;Louis_DRK;900;1;#9LVQLR;Band of Adultes;4;0;4;0;Executioner, Golden Knight, Mega Knight, Lightning, The Log, Electro Spirit, Hog Rider, Guards;RangeBattle;Royal Recruits, Barbarian Barrel, Goblin Cage, Fireball, Flying Machine, Arrows, Royal Hogs, Zappies;Duelo;Goblin Drill, Dark Prince, Giant Snowball, Goblin Demolisher, Cannon, Poison, Fire Spirit, Bats;Duelo;Skeleton Barrel, Goblins, Wall Breakers, Dart Goblin, Rocket, Royal Ghost, Bomb Tower, Rascals;RangeBattle;4;0;900;Tower Princess;3
