data_coleta;dia_batalha;conta_tipo;player_tag;player_nome;player_fame;player_posicao;clan_tag;clan_nome;clan_posicao;clan_fame;decks_usados;boat_attacks;deck_1;deck_1_tipo;deck_2;deck_2_tipo;deck_3;deck_3_tipo;deck_4;deck_4_tipo;war_vitorias;war_derrotas;war_medals;war_torre;war_battles_count
2026-07-02;Reset;#2QR292P;#V8YQCRC9J;mimmoqaddam;100;1;#99V9V22C;IRAN SOLID;3;100;1;0;Witch, Knight, Mighty Miner, Princess, Skeleton Army, Elixir Golem, Giant Snowball, Hunter;RangeBattle;;;;;;;0;1;100;Tower Princess;1
2026-07-02;Reset;#2QR292P;#CQJYV08QJ;wosito;300;3;#LLJPJ2JQ;28 royale 29;1;1700;2;0;Goblin Gang, Boss Bandit, Wizard, Tombstone, Baby Dragon, Freeze, Minion Horde, Arrows;RangeBattle;Cannon, Golden Knight, Skeleton Army, Giant Snowball, Mother Witch, Knight, Mega Minion, Miner;RangeBattle;;;;;1;1;300;Tower Princess;2
2026-07-02;Reset;#2QR292P;#JVGU0Q2Y9;Salvix;400;2;#YYG9V0VC;Orcos Samurai;2;900;3;0;Dart Goblin, Wizard, Magic Archer, Inferno Tower, Goblin Barrel, Skeleton Dragons, Prince, Ram Rider;RangeBattle;Royal Hogs, Dark Prince, Skeleton Barrel, Royal Ghost, Tesla, Minion Horde, Arrows, Elite Barbarians;RangeBattle;Archers, P.E.K.K.A, Mini P.E.K.K.A, Fireball, Baby Dragon, Skeleton Army, Knight, Witch;RangeBattle;;;1;2;400;Tower Princess;3
2026-07-02;Reset;#2QR292P;#V9L9UCLYG;marionatex 223;500;2;#LLJPJ2JQ;28 royale 29;1;1700;4;0;P.E.K.K.A, Golden Knight, Knight, Firecracker, Tornado, Goblin Curse, Ice Spirit, Rage;RangeBattle;Lumberjack, Monk, Wizard, The Log, Cannon, Goblin Gang, Hunter, Ice Wizard;RangeBattle;Dart Goblin, Mighty Miner, Zap, Tesla, Electro Spirit, Bowler, Barbarian Barrel, Valkyrie;RangeBattle;Battle Ram, Musketeer, Mega Knight, Fireball, Giant Snowball, Archers, Mini P.E.K.K.A, Skeleton Army;RangeBattle;1;3;500;Tower Princess;4
2026-07-02;Reset;#2QR292P;#LC90JC98;cristian;500;1;#YYG9V0VC;Orcos Samurai;2;900;4;0;Firecracker, Little Prince, Electro Dragon, Mega Knight, Musketeer, Hog Rider, Zap, Ram Rider;RangeBattle;Archers, Executioner, Royal Giant, Witch, P.E.K.K.A, Valkyrie, Skeleton Army, Wall Breakers;RangeBattle;Golem, Arrows, Skeleton Barrel, Wizard, Magic Archer, Dart Goblin, Mini P.E.K.K.A, Poison;RangeBattle;Giant, Princess, Goblin Gang, Goblin Barrel, Bomber, Sparky, Inferno Dragon, Bats;RangeBattle;1;3;500;Tower Princess;4
2026-07-02;Reset;TOP_GLOBAL;#LLQRRPYC;Glitchy;650;4;#9U82JJ0Y;TheAddictedOnes;3;7600;4;0;Giant Snowball, Goblins, Furnace, Poison, Goblin Drill, Tesla, Berserker, Royal Delivery;RangeBattle;Royal Recruits, Barbarian Barrel, Goblin Cage, Arrows, Royal Hogs, Flying Machine, Zappies, Electro Spirit;Duelo;Royal Ghost, Monk, Wizard, Royal Giant, Fisherman, Fireball, Zap, Fire Spirit;Duelo;Firecracker, Mighty Miner, Cannon, Skeletons, The Log, Hog Rider, Earthquake, Ice Spirit;Duelo;1;2;400;Tower Princess;2
2026-07-02;Reset;TOP_GLOBAL;#LQ20VGY;AM ⚡️ HAZ;650;5;#9U82JJ0Y;TheAddictedOnes;3;7600;4;0;Witch, Mega Minion, Goblin Giant, Giant Skeleton, Zappies, Arrows, Goblin Gang, The Log;RangeBattle;Furnace, Mini P.E.K.K.A, Royal Recruits, Musketeer, Bats, Vines, Barbarian Barrel, Dark Prince;Duelo;Mega Knight, Magic Archer, Royal Ghost, Skeleton Barrel, Skeleton Dragons, Prince, Firecracker, Rage;Duelo;Royal Giant, Wizard, Valkyrie, Goblins, Minions, Knight, Goblin Barrel, Zap;Duelo;1;2;400;Tower Princess;2
2026-07-02;Reset;TOP_GLOBAL;#8UV9CPL2V;Torre the Great;700;3;#9U82JJ0Y;TheAddictedOnes;3;7600;4;0;Firecracker, Golden Knight, Furnace, Royal Hogs, Fireball, Cannon, Royal Recruits, Arrows;RangeBattle;Lumberjack, Mega Minion, Goblin Cage, Poison, Baby Dragon, Flying Machine, Barbarian Barrel, Battle Ram;Duelo;Inferno Dragon, Magic Archer, Witch, Battle Healer, Lightning, Golem, Bomb Tower, Vines;Duelo;Skeleton Barrel, Goblins, Royal Ghost, Suspicious Bush, Rocket, Dart Goblin, Rascals, The Log;Duelo;2;1;600;Tower Princess;2
2026-07-02;Reset;TOP_GLOBAL;#902R98QQ;el roz;700;5;#9LVQLR;Band of Adultes;4;5900;4;0;Royal Hogs, Archer Queen, Giant Snowball, Arrows, Cannon, Royal Delivery, Fire Spirit, Goblins;RangeBattle;Archers, Mini P.E.K.K.A, Knight, Goblin Giant, Fireball, Rage, Minions, Sparky;RangeBattle;Ice Spirit, Hog Rider, Witch, Goblin Hut, Skeletons, Berserker, Earthquake, The Log;Duelo;Mega Knight, Zap, Bats, Miner, Inferno Dragon, Goblin Gang, Spear Goblins, Skeleton Barrel;Duelo;2;2;700;Tower Princess;3
2026-07-02;Reset;TOP_GLOBAL;#RYQGU22;GrainDeMaïs;700;5;#P2P2Y880;! ShocK-13 !;5;8500;4;0;Mortar, Skeleton King, Furnace, Minions, Miner, Goblin Gang, Cannon Cart, Arrows;RangeBattle;Battle Ram, Golden Knight, Zap, Magic Archer, Royal Ghost, P.E.K.K.A, Electro Wizard, Fireball;RangeBattle;Skeleton Barrel, Knight, Goblin Barrel, Skeleton Army, Dart Goblin, Princess, Inferno Tower, The Log;Duelo;Skeletons, Mighty Miner, Firecracker, Barbarian Barrel, Cannon, Hog Rider, Electro Spirit, Lightning;Duelo;2;2;700;Tower Princess;3
2026-07-02;Reset;TOP_GLOBAL;#8P0LR2YCJ;VEN EVOFQ 404CV;800;2;#L9VRJ;Calalas España;1;9250;4;0;Electro Dragon, Wizard, Lumberjack, Golem, Barbarians, Skeleton Dragons, Battle Healer, Tornado;RangeBattle;Mega Knight, Archer Queen, Bats, Prince, Bandit, Goblin Gang, Wall Breakers, Zap;Duelo;Royal Hogs, Golden Knight, Royal Recruits, Goblin Cage, Flying Machine, Zappies, Fireball, Electro Spirit;Duelo;Goblin Giant, Boss Bandit, Archers, Sparky, Dark Prince, Minions, Arrows, Barbarian Barrel;Duelo;3;0;700;Tower Princess;2
2026-07-02;Reset;TOP_GLOBAL;#20GQ9RLUJ;CAL Xervo;800;3;#L9VRJ;Calalas España;1;9250;4;0;Archers, Bats, Goblin Giant, Sparky, Dark Prince, Mini P.E.K.K.A, Rage, Elixir Collector;RangeBattle;Goblin Barrel, Goblins, Dart Goblin, Knight, Cannon, Giant Snowball, Rocket, Fire Spirit;RangeBattle;Royal Recruits, Barbarian Barrel, Royal Hogs, Fireball, Arrows, Zappies, Flying Machine, Goblin Cage;Duelo;Firecracker, Ice Golem, Skeletons, Ice Spirit, Hog Rider, Earthquake, The Log, Bomb Tower;Duelo;3;1;800;Tower Princess;3
2026-07-02;Reset;TOP_GLOBAL;#LVY9UQYY;CAL YPSO ☢️;800;4;#L9VRJ;Calalas España;1;9250;4;0;Goblin Giant, Fireball, Barbarians, Sparky, Zappies, Rage, Bats, Skeleton Dragons;RangeBattle;P.E.K.K.A, Magic Archer, Royal Ghost, Battle Ram, Zap, Poison, Electro Wizard, Bandit;Duelo;Royal Recruits, Balloon, Lumberjack, Giant Snowball, Archers, Mother Witch, Fisherman, Arrows;Duelo;Electro Dragon, Barbarian Barrel, Baby Dragon, Dark Prince, Golem, Tornado, Night Witch, Phoenix;Duelo;3;0;700;Tower Princess;2
2026-07-02;Reset;TOP_GLOBAL;#Q0VLLV29Q;JoJo;800;5;#L9VRJ;Calalas España;1;9250;4;0;Firecracker, Goblins, Valkyrie, Cannon, Earthquake, Arrows, Hog Rider, Ice Spirit;RangeBattle;Executioner, Golden Knight, Goblin Cage, Bomber, Skeletons, Freeze, Graveyard, Tornado;RangeBattle;Dart Goblin, Bowler, Mortar, Minions, Barbarian Barrel, Guards, Fireball, Cannon Cart;Duelo;Skeleton Barrel, Magic Archer, Wall Breakers, Bandit, Dark Prince, Royal Delivery, The Log, Rascals;Duelo;3;1;800;Tower Princess;3
2026-07-02;Reset;TOP_GLOBAL;#2GPLY2CLR;★ NITRO ★;800;1;#9U82JJ0Y;TheAddictedOnes;3;7600;4;0;Goblin Drill, Knight, Giant Snowball, Goblin Demolisher, Berserker, Fire Spirit, Tesla, Poison;RangeBattle;Mega Knight, Goblins, Lumberjack, Ram Rider, Spirit Empress, Furnace, Fireball, Zap;RangeBattle;Royal Hogs, Musketeer, Royal Ghost, Ice Spirit, Skeletons, Goblin Hut, The Log, Earthquake;Duelo;Royal Giant, Barbarian Barrel, Monk, Hunter, Fisherman, Electro Spirit, Guards, Lightning;Duelo;3;1;800;Tower Princess;3
2026-07-02;Reset;TOP_GLOBAL;#9L992LRRV;Lobo;800;2;#9U82JJ0Y;TheAddictedOnes;3;7600;4;0;Bomber, Knight, Electro Dragon, Tornado, Lumberjack, Skeleton Dragons, Elixir Collector, Golem;RangeBattle;Goblin Cage, Barbarian Barrel, Royal Recruits, Furnace, Flying Machine, Zappies, Fireball, Royal Hogs;Duelo;Bats, Archer Queen, Mega Knight, Wall Breakers, Bandit, Goblin Gang, Arrows, Prince;Duelo;Battle Ram, Boss Bandit, P.E.K.K.A, Zap, Royal Ghost, Magic Archer, Electro Wizard, Poison;Duelo;3;0;700;Tower Princess;2
2026-07-02;Reset;TOP_GLOBAL;#R9QQ00PR;Guillermiento;800;4;#9LVQLR;Band of Adultes;4;5900;4;0;Goblin Cage, Golden Knight, Inferno Dragon, Bowler, Arrows, Zappies, Freeze, Graveyard;RangeBattle;Skeleton Barrel, Skeleton King, Skeleton Army, Dart Goblin, Fire Spirit, Suspicious Bush, Vines, Mother Witch;RangeBattle;Valkyrie, Archer Queen, Bats, Mortar, Skeletons, Electro Spirit, Miner, Fireball;Duelo;Mega Knight, Little Prince, Royal Ghost, Goblins, Furnace, Giant Snowball, Ram Rider, Lightning;Duelo;3;1;800;Tower Princess;3
2026-07-02;Reset;TOP_GLOBAL;#PV80LR2G8;GX 〆 Mømm¥ ツ;800;1;#P2P2Y880;! ShocK-13 !;5;8500;4;0;Firecracker, Mighty Miner, Tesla, Goblins, Earthquake, Hog Rider, The Log, Ice Spirit;RangeBattle;Goblin Giant, Dark Prince, Zap, Electro Wizard, Minions, Sparky, Mini P.E.K.K.A, Rage;RangeBattle;Mega Knight, Archer Queen, Wall Breakers, Bandit, Prince, Goblin Gang, Giant Snowball, Arrows;Duelo;Furnace, Knight, Goblin Cage, Berserker, Graveyard, Ice Wizard, Tornado, Poison;Duelo;3;1;800;Tower Princess;3
2026-07-02;Reset;TOP_GLOBAL;#JCCUUVLV;! GX ! Casaar !;800;2;#P2P2Y880;! ShocK-13 !;5;8500;4;0;Royal Giant, Golden Knight, Royal Ghost, Fireball, Electro Spirit, Hunter, Barbarian Barrel, Bats;RangeBattle;Lumberjack, Balloon, Electro Dragon, Cannon, Inferno Dragon, Bowler, Freeze, Tornado;RangeBattle;Mega Knight, Mini P.E.K.K.A, Skeleton Barrel, Ram Rider, Arrows, Minions, Bandit, Goblin Cage;Duelo;Firecracker, Knight, Skeletons, Earthquake, Tesla, Hog Rider, Ice Spirit, The Log;Duelo;3;1;800;Tower Princess;3
2026-07-02;Reset;TOP_GLOBAL;#P2RR229QJ;Rinkashimi;800;3;#P2P2Y880;! ShocK-13 !;5;8500;4;0;Valkyrie, Magic Archer, Mini P.E.K.K.A, Fireball, Bats, Vines, Ice Spirit, Ram Rider;RangeBattle;Battle Ram, Golden Knight, Executioner, Arrows, Zap, Minions, Bandit, P.E.K.K.A;Duelo;Firecracker, Knight, Tesla, Earthquake, The Log, Hog Rider, Royal Delivery, Skeletons;Duelo;Mega Knight, Archer Queen, Giant Snowball, Royal Hogs, Royal Ghost, Lightning, Guards, Electro Spirit;Duelo;3;0;700;Tower Princess;2
2026-07-02;Reset;TOP_GLOBAL;#Q0CRVCQR9;2093 Arley;800;4;#P2P2Y880;! ShocK-13 !;5;8500;4;0;Tesla, Barbarian Barrel, Dart Goblin, Goblin Barrel, Knight, Goblin Gang, Skeleton Army, Rascals;RangeBattle;Cannon, Dark Prince, Skeletons, Rocket, Royal Delivery, The Log, Miner, Electro Spirit;Duelo;Electro Dragon, Balloon, Lumberjack, Tornado, Freeze, Valkyrie, Goblin Cage, Ice Wizard;Duelo;P.E.K.K.A, Golden Knight, Firecracker, Fireball, Zap, Minions, Battle Ram, Royal Ghost;Duelo;3;0;700;Tower Princess;2
2026-07-02;Reset;TOP_GLOBAL;#2LR2UJY82;Cristian;900;1;#L9VRJ;Calalas España;1;9250;4;0;Mega Knight, Wizard, Mini P.E.K.K.A, Bomber, Bandit, Battle Ram, Zap, Poison;RangeBattle;Baby Dragon, Night Witch, Lumberjack, Golem, Mega Minion, Barbarian Barrel, Tornado, Lightning;RangeBattle;Goblin Barrel, Ice Spirit, Knight, Princess, Goblin Gang, The Log, Inferno Tower, Rocket;Duelo;Valkyrie, Musketeer, Tesla, Hog Rider, Giant Snowball, Goblins, Fireball, Fire Spirit;Duelo;4;0;900;Tower Princess;3
2026-07-02;Reset;TOP_GLOBAL;#9YLQRJC;MuK｜⚡Re Fymo⚡;900;1;#8UJ2UUJ8;#MuUuKaNs!!;2;8250;4;0;Goblin Giant, Mini P.E.K.K.A, Zap, Minions, Mother Witch, Sparky, Dark Prince, Rage;RangeBattle;Mega Knight, Archer Queen, Wall Breakers, Bandit, Bats, Goblin Gang, Arrows, Prince;RangeBattle;Furnace, Mighty Miner, Goblins, Cannon, Ice Spirit, Hog Rider, The Log, Lightning;Duelo;Royal Giant, Barbarian Barrel, Royal Ghost, Hunter, Fisherman, Electro Spirit, Skeletons, Fireball;Duelo;4;0;900;Tower Princess;3
2026-07-02;Reset;TOP_GLOBAL;#GQCVU8UJ;MuK｜⚡Oracolo™⚡;900;2;#8UJ2UUJ8;#MuUuKaNs!!;2;8250;4;0;Barbarians, Boss Bandit, Battle Ram, Musketeer, Elixir Collector, Royal Ghost, Arrows, Heal Spirit;RangeBattle;Royal Recruits, Barbarian Barrel, Goblin Cage, Fireball, Royal Hogs, Flying Machine, Zappies, Goblin Gang;RangeBattle;Goblin Drill, Knight, Giant Snowball, Goblins, Cannon, Poison, Ice Spirit, Furnace;Duelo;Firecracker, Mighty Miner, Tesla, Hog Rider, Electro Spirit, The Log, Earthquake, Skeletons;Duelo;4;0;900;Tower Princess;3
2026-07-02;Reset;TOP_GLOBAL;#CJ9G8PPPY;MuK｜⚡MiniAlex™⚡;900;3;#8UJ2UUJ8;#MuUuKaNs!!;2;8250;4;0;Valkyrie, Goblins, Executioner, Ice Spirit, Hog Rider, Rocket, Tornado, The Log;RangeBattle;Mega Knight, Archer Queen, Bats, Wall Breakers, Prince, Bandit, Goblin Gang, Arrows;Duelo;Goblin Giant, Mini P.E.K.K.A, Zap, Rage, Minions, Mother Witch, Sparky, Dark Prince;Duelo;Royal Giant, Wizard, Royal Ghost, Skeletons, Fireball, Fisherman, Barbarian Barrel, Electro Spirit;RangeBattle;4;0;900;Tower Princess;3
2026-07-02;Reset;TOP_GLOBAL;#2UU9VULR;MuK｜⚡Mozz0™⚡;900;4;#8UJ2UUJ8;#MuUuKaNs!!;2;8250;4;0;Goblin Drill, Mighty Miner, Wall Breakers, Bomb Tower, Poison, Spear Goblins, Fire Spirit, Guards;RangeBattle;Royal Hogs, Archer Queen, Cannon, Goblins, Royal Delivery, The Log, Earthquake, Ice Spirit;RangeBattle;Mortar, Skeleton King, Bats, Miner, Cannon Cart, Goblin Gang, Ice Wizard, Arrows;Duelo;Archers, Knight, Tesla, X-Bow, Fireball, Skeletons, Electro Spirit, Barbarian Barrel;Duelo;4;0;900;Tower Princess;3
2026-07-02;Reset;TOP_GLOBAL;#CCU9089PU;MuK｜⚡Alex™⚡;900;5;#8UJ2UUJ8;#MuUuKaNs!!;2;8250;4;0;Valkyrie, Goblins, Executioner, Ice Spirit, Hog Rider, Rocket, Tornado, The Log;RangeBattle;Mega Knight, Archer Queen, Bats, Wall Breakers, Prince, Bandit, Goblin Gang, Arrows;Duelo;Goblin Giant, Mini P.E.K.K.A, Zap, Rage, Minions, Mother Witch, Sparky, Dark Prince;Duelo;Royal Giant, Wizard, Royal Ghost, Fisherman, Fireball, Skeletons, Electro Spirit, Barbarian Barrel;RangeBattle;4;0;900;Tower Princess;3
2026-07-02;Reset;TOP_GLOBAL;#Q89UV8VU;Dodox;900;1;#9LVQLR;Band of Adultes;4;5900;4;0;Furnace, Golden Knight, Tombstone, Berserker, Graveyard, Giant Skeleton, Arrows, Poison;RangeBattle;Goblin Cage, Barbarian Barrel, Royal Hogs, Royal Recruits, Fireball, Zappies, Cannon Cart, Flying Machine;RangeBattle;Electro Dragon, Golem, Inferno Dragon, Lumberjack, Battle Healer, Barbarians, Tornado, Elixir Collector;Duelo;Bats, Skeleton King, Skeletons, Elixir Golem, Lightning, Night Witch, Phoenix, The Log;Duelo;4;0;900;Tower Princess;3
2026-07-02;Reset;TOP_GLOBAL;#8J8VPG8VQ;✨️ManuBait✨️;900;2;#9LVQLR;Band of Adultes;4;5900;4;0;Musketeer, Giant, Bowler, Graveyard, Giant Snowball, Arrows, Night Witch, Guards;RangeBattle;Royal Hogs, Wizard, Royal Ghost, Lightning, Barbarian Barrel, Skeletons, Ice Spirit, Goblin Hut;RangeBattle;Goblin Barrel, Knight, Skeleton Army, Wall Breakers, Dart Goblin, Princess, Electro Spirit, Cannon;Duelo;Minion Horde, Goblins, Bats, Skeleton Barrel, Mega Knight, Goblin Gang, Rage, Miner;Duelo;4;0;900;Tower Princess;3
2026-07-02;Reset;TOP_GLOBAL;#88PQVUQP8;KiruaEikichi;900;3;#9LVQLR;Band of Adultes;4;5900;4;0;Royal Giant, Wizard, Mini P.E.K.K.A, Fisherman, Guards, Electro Spirit, Rage, Lightning;RangeBattle;Battle Ram, Magic Archer, P.E.K.K.A, Royal Ghost, Dark Prince, Electro Wizard, Zap, Freeze;RangeBattle;Royal Recruits, Golden Knight, Goblin Cage, Flying Machine, Royal Hogs, Zappies, Arrows, Barbarian Barrel;Duelo;Valkyrie, Mega Minion, Baby Dragon, Lava Hound, Tombstone, Balloon, Vines, Fireball;Duelo;4;0;900;Tower Princess;3
2026-07-02;Reset;#2QR292P;#JGQ0YQ0J;KickboxinG;900;1;#LLJPJ2JQ;28 royale 29;1;1700;4;0;Inferno Dragon, Musketeer, Wizard, Golem, Skeleton Barrel, Valkyrie, Dart Goblin, Wall Breakers;RangeBattle;Knight, Mega Minion, Bomber, Fireball, Bandit, Rocket, Night Witch, The Log;RangeBattle;Baby Dragon, Skeleton King, Goblin Giant, Poison, Prince, Firecracker, Mortar, Mini P.E.K.K.A;Duelo;Royal Hogs, Hog Rider, Furnace, Flying Machine, Mega Knight, Ice Spirit, Bats, Spear Goblins;Duelo;4;0;900;Tower Princess;3
