data_coleta;dia_batalha;conta_tipo;player_tag;player_nome;player_fame;player_posicao;clan_tag;clan_nome;clan_posicao;clan_fame;decks_usados;boat_attacks;deck_1;deck_1_tipo;deck_2;deck_2_tipo;deck_3;deck_3_tipo;deck_4;deck_4_tipo;war_vitorias;war_derrotas;war_medals;war_torre;war_battles_count
2026-06-25;Reset;#2QR292P;#ULQ9UR0QL;Gui_O_Bruxo;150;1;#QCLPL9VQ;Tropa Do Bruxo;4;0;0;0;Goblin Gang, Witch, Mega Knight, Skeleton Army, Goblin Barrel, Royal Recruits, Baby Dragon, P.E.K.K.A;Barco;Sparky, Barbarians, Ram Rider, Royal Ghost;Barco;;;;;0;2;150;Tower Princess;2
2026-06-25;Reset;#2QR292P;#JVGU0Q2Y9;Salvix;400;1;#YYG9V0VC;Orcos Samurai;3;0;2;0;Royal Hogs, Dark Prince, Skeleton Barrel, Royal Ghost, Tesla, Minion Horde, Arrows, Elite Barbarians;RangeBattle;Archers, P.E.K.K.A, Mini P.E.K.K.A, Fireball, Baby Dragon, Skeleton Army, Knight, Witch;RangeBattle;;;;;2;0;400;Tower Princess;2
2026-06-25;Reset;TOP_GLOBAL;#9J0UV80L9;Arturo;650;4;#8UJ2UUJ8;#MuUuKaNs!!;2;0;4;0;Witch, Bowler, Giant Snowball, Giant, Vines, Minions, Mini P.E.K.K.A, Graveyard;RangeBattle;Goblin Barrel, Dark Prince, Dart Goblin, The Log, Rocket, Rascals, Princess, Goblin Gang;Duelo;Mega Knight, Archer Queen, Bats, Zap, Prince, Wall Breakers, Arrows, Miner;Duelo;Royal Recruits, Barbarian Barrel, Goblin Cage, Fireball, Electro Spirit, Royal Hogs, Flying Machine, Zappies;Duelo;1;2;400;Tower Princess;2
2026-06-25;Reset;TOP_GLOBAL;#V9JY90V2;maximilian995;650;5;#8UJ2UUJ8;#MuUuKaNs!!;2;0;4;0;Mega Knight, Archer Queen, Giant Snowball, Lightning, Ram Rider, Guards, Bats, Bandit;RangeBattle;Goblin Giant, Mini P.E.K.K.A, Zap, Sparky, Rage, Dark Prince, Mother Witch, Mega Minion;Duelo;Royal Ghost, Golden Knight, P.E.K.K.A, Magic Archer, Fireball, Electro Wizard, Arrows, Battle Ram;Duelo;Lumberjack, Balloon, Electro Dragon, Bowler, Freeze, Barbarian Barrel, Tornado, Inferno Dragon;Duelo;1;2;400;Tower Princess;2
2026-06-25;Reset;TOP_GLOBAL;#LQ20VGY;AM ⚡️ HAZ;650;4;#9U82JJ0Y;TheAddictedOnes;3;0;4;0;Witch, Mega Minion, Goblin Giant, Giant Skeleton, Zappies, Arrows, Goblin Gang, The Log;RangeBattle;Furnace, Mini P.E.K.K.A, Royal Recruits, Musketeer, Bats, Vines, Barbarian Barrel, Dark Prince;Duelo;Mega Knight, Magic Archer, Royal Ghost, Skeleton Barrel, Skeleton Dragons, Prince, Firecracker, Rage;Duelo;Royal Giant, Wizard, Valkyrie, Goblins, Minions, Knight, Goblin Barrel, Zap;Duelo;1;2;400;Tower Princess;2
2026-06-25;Reset;TOP_GLOBAL;#2L2C8LRR;Sardaukar;650;5;#9U82JJ0Y;TheAddictedOnes;3;0;4;0;Inferno Dragon, Musketeer, Mega Knight, Bomb Tower, Knight, Hog Rider, Poison, Vines;RangeBattle;Barbarians, Phoenix, Electro Dragon, Battle Healer, Elixir Golem, Rage, Tornado, Void;Duelo;Battle Ram, Bandit, Wizard, Fireball, Zap, Goblin Hut, P.E.K.K.A, Electro Wizard;Duelo;Witch, Mega Minion, Lumberjack, Golem, Arrows, Cannon, Mini P.E.K.K.A, Lightning;Duelo;1;2;400;Tower Princess;2
2026-06-25;Reset;TOP_GLOBAL;#8C2LCCVP;Ve2 I ☢️markez☢;700;5;#L9VRJ;Calalas España;1;0;3;0;Mega Knight, Archer Queen, Wall Breakers, Giant Snowball, Minions, Vines, Prince, Miner;RangeBattle;Royal Recruits, Wizard, Goblin Cage, Arrows, Zappies, Fireball, Royal Hogs, Electro Spirit;Duelo;Skeleton Barrel, Magic Archer, Barbarians, Clone, Earthquake, Flying Machine, Giant Skeleton, Skeleton Dragons;Duelo;;;3;0;700;Tower Princess;2
2026-06-25;Reset;TOP_GLOBAL;#9QJRCQPQ;Trocca;700;3;#8UJ2UUJ8;#MuUuKaNs!!;2;0;3;0;Tesla, Goblins, Valkyrie, Earthquake, Hog Rider, Firecracker, The Log, Ice Spirit;RangeBattle;Musketeer, Barbarian Barrel, Skeletons, Balloon, Miner, Ice Golem, Giant Snowball, Bomb Tower;Duelo;Inferno Dragon, Golden Knight, Executioner, Freeze, Bowler, Zappies, Graveyard, Tornado;Duelo;;;3;0;700;Tower Princess;2
2026-06-25;Reset;TOP_GLOBAL;#8P0LR2YCJ;VEN EVOFQ 404CV;800;3;#L9VRJ;Calalas España;1;0;4;0;Mega Knight, Archer Queen, Bats, Prince, Bandit, Goblin Gang, Wall Breakers, Zap;Duelo;Goblin Giant, Boss Bandit, Archers, Sparky, Dark Prince, Minions, Arrows, Barbarian Barrel;Duelo;Electro Dragon, Goblins, Furnace, Golem, Barbarians, Skeleton Dragons, Lumberjack, Tornado;Duelo;Royal Hogs, Golden Knight, Royal Recruits, Goblin Cage, Flying Machine, Zappies, Fireball, Electro Spirit;RangeBattle;3;0;700;Tower Princess;2
2026-06-25;Reset;TOP_GLOBAL;#8G2CJG9L;pяiисе;800;4;#L9VRJ;Calalas España;1;0;4;0;Lumberjack, Wizard, Battle Ram, Giant Skeleton, Arrows, Zappies, Giant Snowball, Fireball;RangeBattle;;;;;;;1;0;200;Tower Princess;1
2026-06-25;Reset;TOP_GLOBAL;#9QUVUL2LL;Captain Levi;800;1;#9U82JJ0Y;TheAddictedOnes;3;0;4;0;Inferno Dragon, Musketeer, Mega Knight, Knight, Poison, Hog Rider, Vines, Bomb Tower;RangeBattle;Witch, Mega Minion, Lumberjack, Arrows, Cannon, Golem, Mini P.E.K.K.A, Lightning;RangeBattle;Barbarians, Phoenix, Electro Dragon, Elixir Golem, Battle Healer, Tornado, Rage, Void;Duelo;Battle Ram, P.E.K.K.A, Wizard, Bandit, Zap, Electro Wizard, Goblin Hut, Fireball;Duelo;3;1;800;Tower Princess;3
2026-06-25;Reset;TOP_GLOBAL;#YQU0029C8;Hog❤️Miners;800;2;#9U82JJ0Y;TheAddictedOnes;3;0;4;0;Giant Snowball, Bowler, Giant, Minions, Guards, Mini P.E.K.K.A, Vines, Graveyard;RangeBattle;Mortar, Skeleton King, Skeleton Barrel, Rascals, Cannon Cart, Goblin Gang, Fireball, Barbarian Barrel;Duelo;Cannon, Mighty Miner, Firecracker, The Log, Earthquake, Hog Rider, Skeletons, Electro Spirit;Duelo;Royal Recruits, Golden Knight, Goblin Cage, Royal Hogs, Fire Spirit, Flying Machine, Arrows, Zappies;Duelo;3;0;700;Tower Princess;2
2026-06-25;Reset;TOP_GLOBAL;#8UV9CPL2V;Torre the Great;800;3;#9U82JJ0Y;TheAddictedOnes;3;0;4;0;Inferno Dragon, Magic Archer, Witch, Battle Healer, Lightning, Golem, Bomb Tower, Vines;RangeBattle;Lumberjack, Mega Minion, Goblin Cage, Poison, Baby Dragon, Flying Machine, Barbarian Barrel, Battle Ram;Duelo;Firecracker, Golden Knight, Furnace, Royal Hogs, Fireball, Cannon, Royal Recruits, Arrows;Duelo;Skeleton Barrel, Goblins, Royal Ghost, Suspicious Bush, Rocket, Dart Goblin, Rascals, The Log;Duelo;3;0;700;Tower Princess;2
2026-06-25;Reset;TOP_GLOBAL;#8P2V9LJP;ROZE;800;4;#9LVQLR;Band of Adultes;4;0;4;0;Goblin Barrel, Goblins, Valkyrie, Wall Breakers, Princess, Dart Goblin, Ice Spirit, Cannon;RangeBattle;Battle Ram, Bowler, Lumberjack, Giant Skeleton, Mother Witch, Fisherman, Zappies, Arrows;Duelo;Firecracker, Knight, Tesla, Hog Rider, Earthquake, Skeletons, Royal Delivery, The Log;Duelo;Skeleton Barrel, Barbarian Barrel, Mortar, Cannon Cart, Berserker, Fireball, Goblin Gang, Ice Wizard;Duelo;3;0;700;Tower Princess;2
2026-06-25;Reset;TOP_GLOBAL;#P8VC28YQ;Krakotte;800;5;#9LVQLR;Band of Adultes;4;0;4;0;Royal Ghost, Battle Ram, Magic Archer, Zap, P.E.K.K.A, Bandit, Electro Wizard, Poison;Duelo;Mega Knight, Goblin Cage, Royal Recruits, Zappies, Flying Machine, Arrows, Fireball, Royal Hogs;Duelo;Valkyrie, Mortar, Musketeer, Prince, Graveyard, Giant Snowball, Baby Dragon, Tornado;Duelo;Royal Giant, Witch, Knight, Barbarian Barrel, Lightning, Firecracker, Guards, Dark Prince;RangeBattle;3;0;700;Tower Princess;2
2026-06-25;Reset;TOP_GLOBAL;#YLL0RGP8;Knolley;800;4;#P2P2Y880;! ShocK-13 !;5;0;4;0;Knight, Graveyard, Tombstone, Poison, Baby Dragon, Tornado, Ice Wizard, Barbarian Barrel;RangeBattle;Mega Knight, Dark Prince, Lumberjack, Ram Rider, Zap, Fireball, Royal Ghost, Phoenix;RangeBattle;Valkyrie, Guards, Firecracker, The Log, Ice Spirit, Earthquake, Hog Rider, Tesla;Duelo;Royal Recruits, Goblin Cage, Royal Hogs, Mother Witch, Electro Spirit, Arrows, Zappies, Flying Machine;Duelo;3;1;800;Tower Princess;3
2026-06-25;Reset;TOP_GLOBAL;#JCCUUVLV;! GX ! Casaar !;800;5;#P2P2Y880;! ShocK-13 !;5;0;4;0;Mega Knight, Mini P.E.K.K.A, Skeleton Barrel, Ram Rider, Arrows, Minions, Bandit, Goblin Cage;RangeBattle;Lumberjack, Balloon, Electro Dragon, Cannon, Inferno Dragon, Bowler, Freeze, Tornado;RangeBattle;Firecracker, Knight, Skeletons, Earthquake, Tesla, Hog Rider, Ice Spirit, The Log;Duelo;Royal Giant, Golden Knight, Royal Ghost, Fireball, Electro Spirit, Hunter, Barbarian Barrel, Bats;Duelo;3;1;800;Tower Princess;3
2026-06-25;Reset;TOP_GLOBAL;#LU0QVLUL;Grilletto;900;1;#L9VRJ;Calalas España;1;0;4;0;Bomber, Golem, Electro Dragon, Heal Spirit, Elite Barbarians, Baby Dragon, Lumberjack, Tornado;RangeBattle;Royal Recruits, Barbarian Barrel, Goblin Cage, Royal Hogs, Flying Machine, Fireball, Zappies, Electro Spirit;RangeBattle;Goblin Giant, Mini P.E.K.K.A, Zap, Electro Wizard, Rage, Sparky, Dark Prince, Phoenix;Duelo;Barbarians, Skeleton Dragons, Skeleton Barrel, Cannon Cart, Giant Skeleton, Arrows, Mother Witch, Clone;Duelo;4;0;900;Tower Princess;3
2026-06-25;Reset;TOP_GLOBAL;#2LV8RL09J;Festinho 7;900;2;#L9VRJ;Calalas España;1;0;4;0;Royal Recruits, Royal Hogs, Goblin Cage, Flying Machine, Zappies, Fireball, Electro Spirit, Arrows;RangeBattle;Skeleton Army, Fire Spirit, Zap, Inferno Tower, Prince, Elite Barbarians, Hog Rider, The Log;Duelo;Royal Ghost, Magic Archer, P.E.K.K.A, Electro Wizard, Poison, Giant Snowball, Ram Rider, Dark Prince;Duelo;Lumberjack, Bowler, Electro Dragon, Freeze, Inferno Dragon, Tornado, Barbarian Barrel, Balloon;RangeBattle;4;0;900;Tower Princess;3
2026-06-25;Reset;TOP_GLOBAL;#2Q8LLC2;KOOPMEINERS;900;1;#8UJ2UUJ8;#MuUuKaNs!!;2;0;4;0;Goblin Barrel, Cannon, Valkyrie, Dart Goblin, Goblin Gang, Princess, Wall Breakers, Ice Spirit;RangeBattle;Tesla, Mighty Miner, Firecracker, Electro Spirit, The Log, Earthquake, Skeletons, Hog Rider;RangeBattle;Royal Recruits, Barbarian Barrel, Goblin Cage, Arrows, Flying Machine, Royal Hogs, Fireball, Zappies;Duelo;Executioner, Golden Knight, Inferno Dragon, Graveyard, Tornado, Bowler, Freeze, Guards;Duelo;4;0;900;Tower Princess;3
2026-06-25;Reset;TOP_GLOBAL;#228C80JCL;MuK｜⚡️Mari 冰姬⚡️;900;2;#8UJ2UUJ8;#MuUuKaNs!!;2;0;4;0;Furnace, Mighty Miner, Goblins, The Log, Lightning, Ice Spirit, Hog Rider, Cannon;RangeBattle;Mega Knight, Archer Queen, Wall Breakers, Prince, Arrows, Goblin Gang, Bandit, Bats;RangeBattle;Goblin Giant, Mini P.E.K.K.A, Zap, Sparky, Mother Witch, Minions, Dark Prince, Rage;Duelo;Royal Giant, Barbarian Barrel, Royal Ghost, Hunter, Fireball, Electro Spirit, Skeletons, Fisherman;Duelo;4;0;900;Tower Princess;3
2026-06-25;Reset;TOP_GLOBAL;#209P8YQR;drixxeb;900;1;#9LVQLR;Band of Adultes;4;0;4;0;Witch, Mini P.E.K.K.A, Dart Goblin, Mega Minion, Giant Snowball, Bowler, Vines, Giant;RangeBattle;Skeletons, Skeleton King, Electro Dragon, Elixir Golem, Night Witch, Lightning, Tornado, Rage;Duelo;Valkyrie, Balloon, Lumberjack, Goblin Hut, Ice Wizard, Poison, Barbarian Barrel, Minions;Duelo;Furnace, Boss Bandit, Wall Breakers, Knight, Suspicious Bush, Spear Goblins, Royal Delivery, Cannon;RangeBattle;4;0;900;Tower Princess;3
2026-06-25;Reset;TOP_GLOBAL;#R9QQ00PR;Guillermiento;900;2;#9LVQLR;Band of Adultes;4;0;4;0;Mega Knight, Little Prince, Royal Ghost, Goblins, Furnace, Giant Snowball, Ram Rider, Lightning;RangeBattle;Skeleton Barrel, Skeleton King, Skeleton Army, Dart Goblin, Fire Spirit, Suspicious Bush, Vines, Mother Witch;RangeBattle;Valkyrie, Archer Queen, Bats, Mortar, Skeletons, Electro Spirit, Miner, Fireball;Duelo;Goblin Cage, Golden Knight, Inferno Dragon, Bowler, Arrows, Zappies, Freeze, Graveyard;Duelo;4;0;900;Tower Princess;3
2026-06-25;Reset;TOP_GLOBAL;#R02QQ0RGQ;Treplev;900;3;#9LVQLR;Band of Adultes;4;0;4;0;Cannon, Mighty Miner, Furnace, Lightning, Giant Snowball, Electro Spirit, Hog Rider, Skeletons;RangeBattle;Dart Goblin, Knight, Goblin Barrel, Goblin Gang, Inferno Tower, Princess, Ice Spirit, The Log;RangeBattle;Valkyrie, Goblins, Goblin Cage, Zap, Spirit Empress, Fireball, Skeleton Dragons, Lava Hound;Duelo;Mortar, Spear Goblins, Skeleton Barrel, Barbarian Barrel, Cannon Cart, Minions, Rascals, Poison;Duelo;4;0;900;Tower Princess;3
2026-06-25;Reset;TOP_GLOBAL;#8VQ0GY2Q;RomanLopez™;900;1;#P2P2Y880;! ShocK-13 !;5;0;4;0;Cannon, Archer Queen, Giant Snowball, Goblin Drill, Poison, Fire Spirit, Knight, Goblins;RangeBattle;Royal Ghost, Barbarian Barrel, Royal Giant, Electro Spirit, Fireball, Fisherman, Hunter, Guards;RangeBattle;Mortar, Bowler, Skeleton Barrel, Cannon Cart, Rascals, Dart Goblin, Minions, Arrows;Duelo;Royal Hogs, Dark Prince, Magic Archer, The Log, Skeletons, Tesla, Ice Spirit, Lightning;Duelo;4;0;900;Tower Princess;3
2026-06-25;Reset;TOP_GLOBAL;#G0C8V02;GS I Aearon;900;2;#P2P2Y880;! ShocK-13 !;5;0;4;0;;;;;;;;;0;0;0;Tower Princess;0
2026-06-25;Reset;TOP_GLOBAL;#QU8P09YR;Lukas ❤️ Drill;900;3;#P2P2Y880;! ShocK-13 !;5;0;4;0;Furnace, Mighty Miner, Cannon, Hog Rider, Skeletons, Ice Spirit, The Log, Lightning;RangeBattle;Royal Giant, Barbarian Barrel, Royal Ghost, Electro Spirit, Fireball, Guards, Fisherman, Hunter;RangeBattle;Mortar, Goblins, Skeleton Barrel, Arrows, Skeleton Dragons, Rascals, Minions, Cannon Cart;Duelo;Goblin Drill, Knight, Giant Snowball, Fire Spirit, Berserker, Poison, Tesla, Bomber;Duelo;4;0;900;Tower Princess;3
2026-06-25;Reset;#2QR292P;#JGQ0YQ0J;KickboxinG;900;1;#LLJPJ2JQ;28 royale 29;2;0;4;0;Royal Hogs, Hog Rider, Furnace, Flying Machine, Mega Knight, Ice Spirit, Bats, Spear Goblins;RangeBattle;Valkyrie, Wizard, Inferno Dragon, Golem, Skeleton Barrel, Heal Spirit, Tornado, Wall Breakers;RangeBattle;Baby Dragon, Skeleton King, Goblin Giant, Poison, Prince, Firecracker, Mortar, Mini P.E.K.K.A;Duelo;Knight, Mega Minion, Bomber, Fireball, Bandit, Giant Skeleton, Night Witch, The Log;Duelo;4;0;900;Tower Princess;3
